6902, 2014-09-23, Heather Jarvis, Catherine Hardee, Christian Burks
6903, 2014-09-24, Catherine Hardee, Laura Dziorny, Irv Murray
6904, 2014-09-25, Catherine Hardee, Dolly Moehrle, Joann Taylor
6905, 2014-09-26, Catherine Hardee, Tod Macofsky, Alan Lange
6906, 2014-09-29, Catherine Hardee, Alan Lange, Elisa Korb
6907, 2014-09-30, Elisa Korb, Alex Champlin, Silvia Lesko
6908, 2014-10-01, Elisa Korb, Sara Goodman, Josh Hager
6909, 2014-10-02, Josh Hager, Shawn Choe, Kate Horowitz
6910, 2014-10-03, Shawn Choe, Sam Barker, Dan Ford
6911, 2014-10-06, Shawn Choe, Terri Pous, Linda Fraley
6912, 2014-10-07, Terri Pous, Brendan McParland, Carol McGhee
6913, 2014-10-08, Terri Pous, Emily Herndon, Jason Washington
6914, 2014-10-09, Emily Herndon, Venkat Krishnan, Rena Morse
6915, 2014-10-10, Rena Morse, Elizabeth Crofton, Shane Curtis
6916, 2014-10-13, Shane Curtis, Dan Tran, Amanda Brown
6917, 2014-10-14, Shane Curtis, Dan Tran, Candice Torres
6918, 2014-10-15, Shane Curtis, John Campbell, Regina Cabrera
6919, 2014-10-16, John Campbell, Chris Hoeh, Jim Hamilton
6920, 2014-10-17, John Campbell, Alexander Persaud, Sarah Horvitz
6921, 2014-10-20, Alexander Persaud, Frederick Foster, Emma King
6922, 2014-10-21, Alexander Persaud, Deb Williams, Elizabeth Webster
6923, 2014-10-22, Alexander Persaud, Ali Palmer, Mike Harwood
6924, 2014-10-23, Ali Palmer, Angela Chuang, Matthew LaMagna
6925, 2014-10-24, Matthew LaMagna, Amy Thon, Sam Heft-Luthy
6926, 2014-10-27, Matthew LaMagna, Dori Phillips, Bill Albertini
6927, 2014-10-28, Bill Albertini, Michael Wille, Jenica Jessen
6928, 2014-10-29, Bill Albertini, Jenica Jessen, Ryan Alley
6929, 2014-10-30, Ryan Alley, Eileen Dreyer, Allison Solomon
6930, 2014-10-31, Ryan Alley, Allison Solomon, Tyler Johnson
6931, 2014-11-03, Ryan Alley, Conor Sullivan, Casey LaPlante
6932, 2014-11-04, Casey LaPlante, Jason Newell, Caitlin Malcuit
6933, 2014-11-05, Caitlin Malcuit, Aric Wiest, Hillary Huttenhower
6934, 2014-11-06, Hillary Huttenhower, Charles Brower, Che Smith
6935, 2014-11-07, Charles Brower, Cyle Anderson, Jennifer Healy
6946, 2014-11-24, Jennifer Healy, Courtney Jordan, Doug Perez
6947, 2014-11-25, Doug Perez, Mariusz Galczynski, Eugene Britton
6948, 2014-11-26, Mariusz Galczynski, Aggie Lee, Joel Stjernholm
6949, 2014-11-27, Aggie Lee, Michelle Chick, David Greisman
6950, 2014-11-28, David Greisman, Sam Sukaton, Ann Conger
6956, 2014-12-08, Ann Conger, Amanda Miller, Patrick Fernandez
6957, 2014-12-09, Ann Conger, MaryBeth Chmielewski, Peter McGillicuddy
6958, 2014-12-10, Peter McGillicuddy, Mindy Miner, Travis Darling
6959, 2014-12-11, Peter McGillicuddy, Jennifer Gilmore, Ryan Pensyl
6960, 2014-12-12, Ryan Pensyl, Emily Moody, Michael Oliphant
6961, 2014-12-15, Ryan Pensyl, Alysha Rooks, Rex Marzke
6962, 2014-12-16, Alysha Rooks, Jean Parker, Josh Vittor
6963, 2014-12-17, Alysha Rooks, Anne Hand, Kurt Fritzsche
6964, 2014-12-18, Kurt Fritzsche, David Emery-Peck, Kevin Hozey
6965, 2014-12-19, Kevin Hozey, Allison Fraser, Chris Trumpy
6966, 2014-12-22, Allison Fraser, Bert Ifill, Carly Shevinsky
6967, 2014-12-23, Allison Fraser, Avishai Gebler, Melissa Applebee
6968, 2014-12-24, Avishai Gebler, Becca Allred, Brian Hamilton
6969, 2014-12-25, Brian Hamilton, Jason Zbanek, Heather Seal-Breslin
6970, 2014-12-26, Brian Hamilton, Amy Williamson, Vaughn Winchell
6971, 2014-12-29, Vaughn Winchell, Thomas Todd, Ramona Bartos
6972, 2014-12-30, Vaughn Winchell, Marcia Kuipers, Dan Eling
6973, 2014-12-31, Vaughn Winchell, Zamir Ahmed, Jennifer Harris
6974, 2015-01-01, Vaughn Winchell, Page Krugman, Elan Sherbill
6975, 2015-01-02, Vaughn Winchell, Mike Blaha, Elliot Yates
6976, 2015-01-05, Elliot Yates, Dara Gocheski, Eric Westra
6977, 2015-01-06, Elliot Yates, Alan Hait, Val Hannon
6978, 2015-01-07, Elliot Yates, Rebecca Speas, Nathan Tsoi
6979, 2015-01-08, Elliot Yates, Elizabeth Scott-Jones, John Schultz
6980, 2015-01-09, John Schultz, Verna Kale, Evan Perkins
6981, 2015-01-12, John Schultz, Ricardo Pineres, Lauren Gambier
6982, 2015-01-13, John Schultz, Jeremy Reff, Abbie Micucci
6983, 2015-01-14, John Schultz, Joshua Qualls, Cyndi Pruss
6984, 2015-01-15, John Schultz, Patricia Kelvin, Amanda Boitano
6985, 2015-01-16, Amanda Boitano, Mehmet Berker, Nicholas Bérubé
6986, 2015-01-19, Nicholas Bérubé, Leah Turpin, Tim Lane
6987, 2015-01-20, Nicholas Bérubé, Daniel Grigg, Rebeca Avila
6988, 2015-01-21, Daniel Grigg, Erin Rhode, Will Anderson
6989, 2015-01-22, Will Anderson, Maggie Schreiter, Todd Coleman
6990, 2015-01-23, Will Anderson, Brad Nehring, Sarah Boulding
6991, 2015-01-26, Brad Nehring, Christine Kim, Eric Park
6992, 2015-01-27, Christine Kim, Jennifer Hindert, Brian Quinn
6993, 2015-01-28, Christine Kim, Marissa Edelman, Andrew Smith
6994, 2015-01-29, Marissa Edelman, Amy Schmidt, Karen Ash
6995, 2015-01-30, Karen Ash, Jim Read, Cate Hollenbeck
7006, 2015-02-16, Karen Ash, Andy Axel, Susan MacKay Smith
7007, 2015-02-17, Andy Axel, Stephanie Engel, Eamon Doyle
7008, 2015-02-18, Stephanie Engel, Christina McTighe, Ravi Subramanian
7009, 2015-02-19, Christina McTighe, Sam Osborne, Diana Zinser
7010, 2015-02-20, Christina McTighe, Dava-Leigh Brush, Ashley Singh
7011, 2015-02-23, Dava-Leigh Brush, Gemma Kaneko, Britt Harter
7012, 2015-02-24, Dava-Leigh Brush, Jeremy Johnson, Shannon Gillard
7013, 2015-02-25, Dava-Leigh Brush, Michael Camiel, Laura Gallo
7014, 2015-02-26, Laura Gallo, Lily Foss, Jose Garriga
7015, 2015-02-27, Jose Garriga, Natalie Kistner, Richmond Curtiss
7016, 2015-03-02, Jose Garriga, Thomas Phillips, Leslie Gordon
7017, 2015-03-03, Thomas Phillips, Alvin Chin, Erin Summers
7018, 2015-03-04, Alvin Chin, Dave Perkins, Laura Lorson
7019, 2015-03-05, Laura Lorson, Austin Roberts, Rebecca Press Schwartz
7020, 2015-03-06, Laura Lorson, Nic Pereira, Rachael Sims
7021, 2015-03-09, Rachael Sims, Mike Ewing, Jen Jabaily Blackburn
7022, 2015-03-10, Jen Jabaily Blackburn, Penny Reid, Mikki Gibson
7023, 2015-03-11, Penny Reid, Kristin Sausville, Jim Luh
7024, 2015-03-12, Kristin Sausville, Brad King, Stephanie Hull
7025, 2015-03-13, Kristin Sausville, Kynan Dias, Shawn Paul
7026, 2015-03-16, Kristin Sausville, Pauline Sholtys, Darren Shea
7027, 2015-03-17, Kristin Sausville, Irene Brockman, Colin Gleeson
7028, 2015-03-18, Kristin Sausville, Daniel Watkins, Andrea Keleher
7029, 2015-03-19, Andrea Keleher, Gina Shaddox, Brandon Bidlack
7030, 2015-03-20, Gina Shaddox, Lesley Cooksey, Alex Navissi
7031, 2015-03-23, Alex Navissi, Nate Burgan, Jill Locascio
7032, 2015-03-24, Alex Navissi, Cindy Garner, Gautam Mukunda
7033, 2015-03-25, Gautam Mukunda, Jacqueline Hawkins, Tim Hague
7034, 2015-03-26, Jacqueline Hawkins, Laura Weiner, Al Cho
7035, 2015-03-27, Jacqueline Hawkins, Michael Bilow, Eric Swanson
7036, 2015-03-30, Michael Bilow, David Zimand, Cynthia Davis
7037, 2015-03-31, Michael Bilow, Erica Rosengart, Julio Trujillo
7038, 2015-04-01, Michael Bilow, Kerry Greene, Max Henkel
7039, 2015-04-02, Kerry Greene, Sharon Boyd, Niels Hirschmann
7040, 2015-04-03, Kerry Greene, Tom Imler, Pat Kavanaugh
7041, 2015-04-06, Kerry Greene, Brian Carrick, Eric Simmonds
7042, 2015-04-07, Kerry Greene, Jan Schwartzberg, Evan Bick
7043, 2015-04-08, Kerry Greene, Travis Miscia, Kaya Chua
7044, 2015-04-09, Kerry Greene, Lindsey Love, Chris Hurt
7045, 2015-04-10, Chris Hurt, Laura Kohlenberg, Alex Jacob
7046, 2015-04-13, Alex Jacob, Carlos Capellan, Kathy Callahan
7047, 2015-04-14, Alex Jacob, Corbin Dill, Mary Suárez
7048, 2015-04-15, Alex Jacob, Doug Butler, Becky Hammer
7049, 2015-04-16, Alex Jacob, Dane Walker, Erin Steinhart
7050, 2015-04-17, Alex Jacob, Nikhil Neelakantan, Scott Blish
7051, 2015-04-20, Alex Jacob, Monica Lott, Todd Lovell
7052, 2015-04-21, Todd Lovell, Michael Brady, Rachel Pepe
7053, 2015-04-22, Michael Brady, Alex Schraff, Ashley Alley
7054, 2015-04-23, Michael Brady, Ellen Burgett, Greg Seroka
7055, 2015-04-24, Greg Seroka, Chip Brookes, Eric Fleury
7056, 2015-04-27, Greg Seroka, Ann Marie Senter, Tim Giauque
7057, 2015-04-28, Greg Seroka, Salvatore Parente, Dani Cook
7058, 2015-04-29, Greg Seroka, Brian Fodera, Sarah Negugogor
7059, 2015-04-30, Greg Seroka, Valerie Braun, Robert Sale
7060, 2015-05-01, Greg Seroka, Chris Gunter, Amanda Garrett
7061, 2015-05-04, Greg Seroka, Praggya Rustagi Barretto, Scott Ylinen
7062, 2015-05-05, Scott Ylinen, Jen Stoy, Dan Green
7063, 2015-05-06, Scott Ylinen, Mike Duval, Rebecca Golden
7064, 2015-05-07, Scott Ylinen, Emily Bialowas, Andrew Haringer
7065, 2015-05-08, Andrew Haringer, Mary Green, Louis Virtel
7071, 2015-05-18, Andrew Haringer, Cindy de la Peña, Fritz Brantley
7072, 2015-05-19, Andrew Haringer, Todd Grabarsky, Liz Rapelye
7073, 2015-05-20, Andrew Haringer, Becky Schiavo, Ben Hom
7074, 2015-05-21, Andrew Haringer, Choyon Manjrekar, Laurie McNeill
7075, 2015-05-22, Choyon Manjrekar, Melissa Lake, Gordon Marx
7076, 2015-05-25, Choyon Manjrekar, Michael Buss, Amy Berg
7077, 2015-05-26, Choyon Manjrekar, Lenny Porges, Dan Feitel
7078, 2015-05-27, Dan Feitel, Kate Cox, Jane Longacre
7079, 2015-05-28, Dan Feitel, Ivan Tan, Adrienne Onofri
7080, 2015-05-29, Dan Feitel, Autumn Swinford, Andrew Lasken
7081, 2015-06-01, Dan Feitel, Randy Pike, Victoria Machado
7082, 2015-06-02, Dan Feitel, Jacob Johnson, Tara Whittle
7083, 2015-06-03, Jacob Johnson, Pete Miranti, Jami Griffeth
7084, 2015-06-04, Jami Griffeth, Addison Godel, Jenny Orr
7085, 2015-06-05, Addison Godel, Jean Koff, Chris Wonderly
7086, 2015-06-08, Chris Wonderly, Sally Wright, Craig Moysey
7087, 2015-06-09, Chris Wonderly, Phil Arevalo, Holly Cooper
7088, 2015-06-10, Phil Arevalo, Martha Holland, Darren Harris-Fain
7089, 2015-06-11, Darren Harris-Fain, Kyle Stephens, Kathryn Tesar
7090, 2015-06-12, Darren Harris-Fain, Mike Luca, Daniel Lee
7091, 2015-06-15, Darren Harris-Fain, Amy Merrick, Brennan Bushee
7092, 2015-06-16, Brennan Bushee, Raf Noboa y Rivera, Batya Diamond
7093, 2015-06-17, Brennan Bushee, Kevin Ruby, Tom Landvatter
7094, 2015-06-18, Brennan Bushee, Ian Giesbrecht, Megan Casey
7095, 2015-06-19, Brennan Bushee, Chad Capule, Jennifer Shepherd
7096, 2015-06-22, Brennan Bushee, Kay Yung, Sacha Samotin
7097, 2015-06-23, Sacha Samotin, Donna Normington, Matt Pressman
7098, 2015-06-24, Matt Pressman, Shayna Kravetz, Pat DeVane
7099, 2015-06-25, Matt Pressman, Ed Cardoni, Desta Kimmel
7100, 2015-06-26, Matt Pressman, Kat Cahill, Ankoor Bagchi
7101, 2015-06-29, Ankoor Bagchi, Brandon Powell, Amanda Mough
7102, 2015-06-30, Brandon Powell, Amy Hollis, Adrian Perez
7103, 2015-07-01, Brandon Powell, Rena Traube, Alex Irvine
7104, 2015-07-02, Alex Irvine, Elsa Angrist, Jon Lubin
7105, 2015-07-03, Jon Lubin, Hilary Carney, Erik Siwak
7106, 2015-07-06, Hilary Carney, Shu-Ping Shen, Jess Lindoerfer
7107, 2015-07-07, Jess Lindoerfer, Sawyer Morgan, Bridget Ker
7108, 2015-07-08, Sawyer Morgan, Ian Borland, Jenny Thorngate
7109, 2015-07-09, Jenny Thorngate, Kathy Riley, Heather Melançon
7110, 2015-07-10, Kathy Riley, Rob Seidenwurm, H.B. Taylor
7111, 2015-07-13, H.B. Taylor, Phil Salathé, Lauren Donahoo
7112, 2015-07-14, Phil Salathé, Ben Hemmens, Val Narehood
7113, 2015-07-15, Ben Hemmens, John Hendel, Alyson Lamble
7114, 2015-07-16, Ben Hemmens, Jennifer Morrow, Christianne Gadd
7115, 2015-07-17, Jennifer Morrow, Lawrence Dernulc, Julia Lawrence
7116, 2015-07-20, Jennifer Morrow, Scott Lord, Mary Ciconte
7117, 2015-07-21, Scott Lord, Eliza Thompson, Jake Smith
7118, 2015-07-22, Scott Lord, Brianne Archer, Kris Dages
7119, 2015-07-23, Scott Lord, Erin Saelzler, Anne-Marie Masse
7120, 2015-07-24, Scott Lord, Tracy McCarthy, Sam Suarez
7121, 2015-07-27, Scott Lord, Suzanne Vito, Luke McQuage
7122, 2015-07-28, Suzanne Vito, Jonathan Marcus, Melissa Hodges
7123, 2015-07-29, Jonathan Marcus, Jennifer Morgan, Colby Potter
7124, 2015-07-30, Colby Potter, Amanda Bruchs, Andy King
7125, 2015-07-31, Andy King, Tara Anderson, Mags Doss
7126, 2015-09-14, Tara Anderson, Rook Thomas Hine, Ed Kim
7127, 2015-09-15, Ed Kim, Andy Anderson, Audrey Watkins-Fox
7128, 2015-09-16, Audrey Watkins-Fox, Talia Lavin, Kevin Butterfield
7129, 2015-09-17, Audrey Watkins-Fox, Bobby O'Neill, Natalie Lips
7130, 2015-09-18, Natalie Lips, Eric Matheis, Tina Uihlein
7131, 2015-09-21, Natalie Lips, Sue Corbett, Gordon Reid
7132, 2015-09-22, Natalie Lips, Mai Kulkarni, Dylan Parson
7133, 2015-09-23, Dylan Parson, Austin Yates, Barbara Gao
7134, 2015-09-24, Dylan Parson, Kyle Baum, Amanda Fieiras
7135, 2015-09-25, Dylan Parson, Laura Varriale, Matt Jackson
7136, 2015-09-28, Matt Jackson, Jedidiah Smith, Vicki Eastus
7137, 2015-09-29, Matt Jackson, Cam Hoang, Alan Sherman
7138, 2015-09-30, Matt Jackson, Dennis Lloyd, Samantha Budesa
7139, 2015-10-01, Matt Jackson, Greg Vinton, Ezgi Ustundag
7140, 2015-10-02, Matt Jackson, Tony Langford, Lindsay Townes
7141, 2015-10-05, Matt Jackson, Ben Rudd, Amanda Brock
7142, 2015-10-06, Matt Jackson, John Kozempel, Ernestine Gardner
7143, 2015-10-07, Matt Jackson, Alison Burke, Susan Thurman
7144, 2015-10-08, Matt Jackson, Erik Latshaw, Sameer Rawal
7145, 2015-10-09, Matt Jackson, Emily Rollman, Elicia Woerle
7146, 2015-10-12, Matt Jackson, Julia Novakovic, Victor Quillen
7147, 2015-10-13, Matt Jackson, Corbett Hancey, Christine Gengaro
7148, 2015-10-14, Matt Jackson, Michael Baker, Sally Hatfield
7149, 2015-10-15, Michael Baker, Josh Silverman, Dana Desprois
7150, 2015-10-16, Josh Silverman, Zelda Pulliam, Matt Akridge
7151, 2015-10-19, Josh Silverman, Martin Schmidt, Dean Meyer
7152, 2015-10-20, Dean Meyer, Robert Arrowood, Alison Saunders
7153, 2015-10-21, Robert Arrowood, Dennis Golin, Kelly Winck
7154, 2015-10-22, Dennis Golin, Philip Clark, Jennifer Robinson
7155, 2015-10-23, Dennis Golin, Becky Sullivan, Sean Anderson
7156, 2015-10-26, Sean Anderson, Beth Horn, Tom Flynn
7157, 2015-10-27, Sean Anderson, Dave Treptow, Jayne Lady
7158, 2015-10-28, Sean Anderson, Chris Lastrapes, Nikki Grillos
7159, 2015-10-29, Nikki Grillos, Damien Martin, Julie Stapel
7160, 2015-10-30, Nikki Grillos, Katie Walker, Justin Morales
7161, 2015-11-02, Katie Walker, Christine Qualey, Marcus Lewis
7162, 2015-11-03, Marcus Lewis, Ryan Mewett, Lisa Price
7163, 2015-11-04, Ryan Mewett, Sam Stubblefield, Jenny Gu
7164, 2015-11-05, Sam Stubblefield, Mike Barrett, Ken Hill
7165, 2015-11-06, Mike Barrett, Laura Ashby, Sadie Iverson
7176, 2015-11-23, Laura Ashby, Colin Thibadeau, Matt Keeshin
7177, 2015-11-24, Laura Ashby, Julie Adair, Molly Hewitt
7178, 2015-11-25, Julie Adair, Ricky Hudson, Saadia Mather
7179, 2015-11-26, Ricky Hudson, Marie Halvorsen-Ganepola, Rob Russell
7180, 2015-11-27, Rob Russell, Darin Brown, Bianca Benincasa
7181, 2015-11-30, Rob Russell, Elaine Baker, Joyce Hshieh
7182, 2015-12-01, Joyce Hshieh, Shea Zellweger, Frankie Lynne
7183, 2015-12-02, Joyce Hshieh, Nicole Stanley, Brad Rudy
7184, 2015-12-03, Joyce Hshieh, Jarrett Cabell, Kelly Wright
7185, 2015-12-04, Kelly Wright, Alexandra Whitehill Smith, Jon Rossiter
7186, 2015-12-07, Jon Rossiter, Liz Fritz, Greg Johnson
7187, 2015-12-08, Liz Fritz, Alex Maggio, Trevor Moore
7188, 2015-12-09, Alex Maggio, Bianca Howard, Jon Lubbers
7189, 2015-12-10, Alex Maggio, Donnie Edgemon, Shannon Lee
7190, 2015-12-11, Alex Maggio, Katie Price, Brandon Haschke
7191, 2015-12-14, Katie Price, Sam McLinn, Michelle Chan
7192, 2015-12-15, Sam McLinn, Tiombi Prince, Rami Fakhouri
7193, 2015-12-16, Tiombi Prince, Ben Parker, Lynsey McMullen
7194, 2015-12-17, Tiombi Prince, Claudia Corriere, Mark Blankenship
7195, 2015-12-18, Claudia Corriere, Julie Graves, Kiyana Holderbaum
7196, 2015-12-21, Liz Quesnelle, Jay O'Brien, Shoshana Gordon Ginsburg
7197, 2015-12-22, Liz Quesnelle, Theresa Tejada, Ted Johnson
7198, 2015-12-23, Theresa Tejada, Joe Quackenbush, Chandreyi Ghosh
7199, 2015-12-24, Chandreyi Ghosh, Markus Kolic, Christina Pulawski
7200, 2015-12-25, Markus Kolic, Emily Poole, Dee Daigle
7201, 2015-12-28, Dee Daigle, Patricia Franco, Stephen Byrd
7202, 2015-12-29, Patricia Franco, Ashley Wilson, Camille Hooper
7203, 2015-12-30, Camille Hooper, Erik Johns, Johnny Saunders
7204, 2015-12-31, Johnny Saunders, Sandro Marchegiani, Ashley Wilson
7205, 2016-01-01, Ashley Wilson, Deborah Henry, Carl Holmgren
7206, 2016-01-04, Ashley Wilson, Terry McElhennon, Charlene Lee
7207, 2016-01-05, Terry McElhennon, Alex Lautanen Walker, Steve Belding
7208, 2016-01-06, Steve Belding, Sheila Churchill, Matt Orlovick
7209, 2016-01-07, Steve Belding, Lizzie Turner, Brian Rafferty
7210, 2016-01-08, Steve Belding, Ava Hadaway, Adam Hoskins
7211, 2016-01-11, Adam Hoskins, Dom Tassoni, Julia Cain
7212, 2016-01-12, Adam Hoskins, Lisa Cech, Amelia Hershberger
7213, 2016-01-13, Amelia Hershberger, Len Mucci, Megan Metcalf
7214, 2016-01-14, Amelia Hershberger, Ellen Huber, Ben Almoite
7215, 2016-01-15, Amelia Hershberger, Jenn Frohlich, Mike Drummond
7216, 2016-01-18, Mike Drummond, Claudia Corriere, Randi Kristensen
7217, 2016-01-19, Hans Kamm, Matt Egbert, Kyle Webb
7218, 2016-01-20, Kyle Webb, Sarah Godwin, Megan Loyd
7219, 2016-01-21, Kyle Webb, Russell Allen, Jennifer Sterling
7220, 2016-01-22, Kyle Webb, Demi Hueth, Fred Vaughn
7221, 2016-01-25, Fred Vaughn, Steven Wolfe, Adrien Schless-Meier
7222, 2016-01-26, Fred Vaughn, Sonam Shah, Gerry Matatics
7223, 2016-01-27, Fred Vaughn, Colin West, Bianca Hegedus
7224, 2016-01-28, Fred Vaughn, Phyllis Kidd, Mara Apostol
7225, 2016-01-29, Mara Apostol, Chris Becker, Sandy Hall
7236, 2016-02-15, Chris Becker, Ramona Riddles, Sarah Wright
7237, 2016-02-16, Chris Becker, Manisha Parekh, Zach Binney
7238, 2016-02-17, Chris Becker, Katie Oliver, Tim Kutz
7239, 2016-02-18, Tim Kutz, Brian Worthington, Shana Macks
7240, 2016-02-19, Tim Kutz, Mitch Metcalfe, Pat Woodard
7241, 2016-02-22, Tim Kutz, Maria Santonato, Joshua Parr
7242, 2016-02-23, Tim Kutz, Ben Yuhas, Robin Heck
7243, 2016-02-24, Ben Yuhas, Jill Panall, Suzy Law
7244, 2016-02-25, Jill Panall, Rebecca Harlow, Chris Giglio
7245, 2016-02-26, Chris Giglio, David Bradley, Bill Murphy
7246, 2016-02-29, David Bradley, Tyler Shattuck, Brigid Hannahoe
7247, 2016-03-01, David Bradley, Titi Ala'ilima, Rachel Zoch
7248, 2016-03-02, Rachel Zoch, Peter Diedrich, John Bozek
7249, 2016-03-03, Rachel Zoch, Ted Dorsey, Soumia Meiyappan
7250, 2016-03-04, Rachel Zoch, Therese Jones, Natasha Gainey
7251, 2016-03-07, Natasha Gainey, Eric Grebing, Brent Povis
7252, 2016-03-08, Brent Povis, Paul Hoan Zeidler, Annie Moriondo
7253, 2016-03-09, Annie Moriondo, Katrina Mundinger, Bill Patschak
7254, 2016-03-10, Katrina Mundinger, Norine Noonan, Danielle Stillman-Diederich
7255, 2016-03-11, Katrina Mundinger, Victor Ferreira, Gordon Moffat
7256, 2016-03-14, Gordon Moffat, Philip Tiu, Amanda Darby
7257, 2016-03-15, Philip Tiu, Kristen Bancroft, Sean Cauley
7258, 2016-03-16, Philip Tiu, Geoff Mitelman, Elena Gray-Blanc
7259, 2016-03-17, Philip Tiu, Chris Horton, Gwen Niksic
7260, 2016-03-18, Gwen Niksic, Steve Stoffle, Aurora Nibley
7261, 2016-03-21, Steve Stoffle, Kim Vu, Melissa Spencer
7262, 2016-03-22, Melissa Spencer, Joshua Wennrich, Claudia Stucke
7263, 2016-03-23, Claudia Stucke, Jen Kadzie, Jessica Kiefer
7264, 2016-03-24, Claudia Stucke, Vivek Srikrishnan, Sarah Thompson
7265, 2016-03-25, Sarah Thompson, Doug Behrend, Sam Gale
7266, 2016-03-28, Doug Behrend, Kent Buxton, Erin Bowers
7267, 2016-03-29, Erin Bowers, Todd Giese, Michelle Bulger Mabery
7268, 2016-03-30, Todd Giese, Megan Selva, Bill Burns
7269, 2016-03-31, Todd Giese, Fariha Ali, Laura Mogul
7270, 2016-04-01, Todd Giese, Oliver Bundy, Milton John
7271, 2016-04-04, Todd Giese, Udit Banerjea, Kerstin Nordstrom
7272, 2016-04-05, Udit Banerjea, Jeff Crosby, Toni Johnson
7273, 2016-04-06, Jeff Crosby, Sabrina Fritz, Paul Belin
7274, 2016-04-07, Jeff Crosby, Ken Sansone, Courtney Corcoran
7275, 2016-04-08, Ken Sansone, Kim Rohrer, Ricky Young
7276, 2016-04-11, Ricky Young, Thaddeus Lisowski, Catherine Kruchten
7277, 2016-04-12, Ricky Young, Carter Spires, Joyce Lynch
7278, 2016-04-13, Carter Spires, Pamela Stewart, Christian Maher
7279, 2016-04-14, Carter Spires, Hannah Gage, Margaret Miles
7280, 2016-04-15, Margaret Miles, Andrew Pau, McKinnie Lee Sizemore
7281, 2016-04-18, Andrew Pau, Sarah Edwards, David Greenberg
7282, 2016-04-19, Andrew Pau, Hilary Hinzmann, Lindsey Ziegler
7283, 2016-04-20, Andrew Pau, Nikhil Damle, Amanda Richards
7284, 2016-04-21, Andrew Pau, Beth Dunn, Jonpaul Guinn
7285, 2016-04-22, Andrew Pau, Amy Hart, Michael Koh
7286, 2016-04-25, Andrew Pau, Jeanne Roper, Buzzy Cohen
7287, 2016-04-26, Buzzy Cohen, Stephanie Hunt, Jerry Vinokurov
7288, 2016-04-27, Buzzy Cohen, Ellen Plitt, Joe Indiviglia
7289, 2016-04-28, Buzzy Cohen, Ben Rothenberg, Heather Burnett
7290, 2016-04-29, Buzzy Cohen, Sanjiv Sarwate, Tal Nadan
7306, 2016-05-23, Buzzy Cohen, Heidi Eichler, John McKay
7307, 2016-05-24, Buzzy Cohen, Brian Roberts, Victor Saymo
7308, 2016-05-25, Buzzy Cohen, Ted Reinhold, Sarah Trowbridge
7309, 2016-05-26, Buzzy Cohen, Riley Molin, Dan Rothfarb
7310, 2016-05-27, Buzzy Cohen, Erin Delaney, Megan Hauser
7311, 2016-05-30, Erin Delaney, Bryna Fischer, Wilcley Lima
7312, 2016-05-31, Erin Delaney, Tim Mercure, Laurie Corrin
7313, 2016-06-01, Tim Mercure, Kelly Bayles, Liz Miles
7314, 2016-06-02, Kelly Bayles, Ariel Watkins, Ed Brown
7315, 2016-06-03, Kelly Bayles, Lincoln Hamilton, Jeremy Eaton
7316, 2016-06-06, Kelly Bayles, Gary Yokie, Stew Latwin
7317, 2016-06-07, Stew Latwin, Malavika Jagannathan, Robert Wood
7318, 2016-06-08, Stew Latwin, Hunter Appler, Torrey Livenick
7319, 2016-06-09, Hunter Appler, Peggy Szymeczek, Mark Adams
7320, 2016-06-10, Hunter Appler, Rick Doyon, Anna Kata
7321, 2016-06-13, Hunter Appler, Amber Garrett, Barbara Amster
7322, 2016-06-14, Hunter Appler, Dana Thurmond Bruno, Zane Dowty
7323, 2016-06-15, Hunter Appler, Beth Masterson, Sarah von Riedemann
7324, 2016-06-16, Hunter Appler, Jim Coder, Liz Haigney Lynch
7325, 2016-06-17, Liz Haigney Lynch, David Sena, Christopher Denault
7326, 2016-06-20, Liz Haigney Lynch, Joe Mulder, Sally Neumann
7327, 2016-06-21, Sally Neumann, Ben Foley, Laurie MacDougall
7328, 2016-06-22, Laurie MacDougall, Megan Mills, Cary Finkelstein
7329, 2016-06-23, Laurie MacDougall, Will Gilbert, Marjika Howarth
7330, 2016-06-24, Laurie MacDougall, Harris Stutman, Peyton Brown
7331, 2016-06-27, Harris Stutman, Susan Sexton, Tony Orcutt
7332, 2016-06-28, Harris Stutman, Jennifer Lloyd, Afam Onyema
7333, 2016-06-29, Harris Stutman, Addie Kluemper, Christie O'Shaughnessy
7334, 2016-06-30, Christie O'Shaughnessy, Dolph Chaney, Shyamlee Patel
7335, 2016-07-01, Shyamlee Patel, Zach Klitzman, Valerie Ryan
7336, 2016-07-04, Zach Klitzman, Liz Hedreen, Justin Lucas
7337, 2016-07-05, Liz Hedreen, TJ Bateman, Julie Vazquez-Souza
7338, 2016-07-06, TJ Bateman, Matt Hoffer-Hawlik, Emily Hillard
7339, 2016-07-07, Matt Hoffer-Hawlik, Neil Sondov, Bonnie Megel
7340, 2016-07-08, Bonnie Megel, Mike Solano, Pam Platt
7341, 2016-07-11, Pam Platt, Jason George, Katie Pieper
7342, 2016-07-12, Jason George, Amy Ware, Jessica Plagens
7343, 2016-07-13, Jason George, Sue Baker, Benn Millman
7344, 2016-07-14, Sue Baker, Ken Fischer, Ellen Corrigan
7345, 2016-07-15, Ellen Corrigan, Siobhan Quinlan, Luke Hales
7346, 2016-07-18, Ellen Corrigan, Hans Huizing, Emily DeArdo
7347, 2016-07-19, Ellen Corrigan, Pranjal Vachaspati, Carolyn Riegle
7348, 2016-07-20, Pranjal Vachaspati, Sophie Carrell, Conor Lastowka
7349, 2016-07-21, Pranjal Vachaspati, Dan Marsh, Kyle Murphy
7350, 2016-07-22, Pranjal Vachaspati, Ross Merriam, Samantha Hartke
7351, 2016-07-25, Pranjal Vachaspati, Kathy Krebs, Anthony Szabo
7352, 2016-07-26, Pranjal Vachaspati, Monikka Mann, Karen Lazar
7353, 2016-07-27, Pranjal Vachaspati, Zlatan Hodzic, Barbra Resnick
7354, 2016-07-28, Barbra Resnick, Todd Gonzalez, Katrina Ice
7355, 2016-07-29, Barbra Resnick, Jim Lebbos, Courtney Paulson
7356, 2016-09-12, Courtney Paulson, David Gottdenker, Annie Busiek
7357, 2016-09-13, Annie Busiek, André Hereford, Elizabeth Troyer
7358, 2016-09-14, Elizabeth Troyer, Scott Bateman, Barbara Colberg
7359, 2016-09-15, Scott Bateman, Siddharth Hariharan, Amy Ramsay
7360, 2016-09-16, Siddharth Hariharan, Brandon Barnes, Christine Schreck
7361, 2016-09-19, Siddharth Hariharan, Dorcas Alexander, Seth Wilson
7362, 2016-09-20, Seth Wilson, Bryan Hlavinka, Rachel Lin
7363, 2016-09-21, Seth Wilson, Sala Levin, Sharren Lee Gibbs
7364, 2016-09-22, Seth Wilson, Kellyn Johnson, Ryan Mill
7365, 2016-09-23, Seth Wilson, Elena Stuewe, Charlie Geer
7366, 2016-09-26, Seth Wilson, Dennis King, Jocelyn Dorfman
7367, 2016-09-27, Seth Wilson, Miranda Prince, Bing Kao
7368, 2016-09-28, Seth Wilson, Erin Post, Harold Leff
7369, 2016-09-29, Seth Wilson, Damien Shirley, Anne Campbell
7370, 2016-09-30, Seth Wilson, Walt Livingston, Erica Dreisbach
7371, 2016-10-03, Seth Wilson, Amy Pistone, George Lyle
7372, 2016-10-04, Seth Wilson, Joe Schneider, Ben Wynns
7373, 2016-10-05, Seth Wilson, Eric Felkey, Margie Eulner Ott
7374, 2016-10-06, Margie Eulner Ott, Randi Rae Arnold, Sarah Flamini
7375, 2016-10-07, Sarah Flamini, Nate Ross, Bryn Keating
7376, 2016-10-10, Nate Ross, Charlie Olsky, Pidge Meade
7377, 2016-10-11, Pidge Meade, Alice Emerson, Kalen Meine
7378, 2016-10-12, Pidge Meade, Russ Williams, Susan Cole
7379, 2016-10-13, Susan Cole, Bhaskara Marthi, Amanda Watson
7380, 2016-10-14, Susan Cole, Keely Walker, Jerry Castro
7381, 2016-10-17, Susan Cole, Marianne Novak, Shannon Dillmore
7382, 2016-10-18, Shannon Dillmore, Jeremy Zarowitz, Anne Exler
7383, 2016-10-19, Shannon Dillmore, Erin Rettler, Debbi Hopkins
7384, 2016-10-20, Debbi Hopkins, Doug Hartman, Hunter Manchak
7385, 2016-10-21, Doug Hartman, Katie Landers, Lani Gonzalez
7386, 2016-10-24, Lani Gonzalez, Susan Logan, Norm Burnosky
7387, 2016-10-25, Lani Gonzalez, Yoey Sacks, Joel Goldes
7388, 2016-10-26, Lani Gonzalez, George Stuart, Erin Henry
7389, 2016-10-27, George Stuart, Ken Hirsh, P.J. Molski
7390, 2016-10-28, Ken Hirsh, Meghan Winch, Julia Lee
7391, 2016-10-31, Julia Lee, Jon Frank, Thea Lawton
