5828, 2010-01-06, Jennifer Broders, Carter Edman, Lysette Tidwell
5829, 2010-01-07, Lysette Tidwell, Andrea Saenz, Brian Chang
5830, 2010-01-08, Andrea Saenz, Vaughn Sandman, Susan Poliniak
5831, 2010-01-11, Susan Poliniak, Mariann Cook Andrews, Alonso Duralde
5832, 2010-01-12, Mariann Cook Andrews, Jennie Burroughs, Jason Zollinger
5833, 2010-01-13, Jason Zollinger, Janna Hutz, Thomas Meringolo
5834, 2010-01-14, Jason Zollinger, Adrianne Hiltz, Andrew Chrzanowski
5835, 2010-01-15, Jason Zollinger, Roddy Arz, Joan Radell
5836, 2010-01-18, Jason Zollinger, Kathy Braue, Fideleon Damian
5837, 2010-01-19, Jason Zollinger, Christine Havens, Dan Campbell
5838, 2010-01-20, Jason Zollinger, Bern Samko, Ted Ahern
5840, 2010-01-22, Ted Ahern, Gila Stadler, Darryl Konter
5841, 2010-01-25, Gila Stadler, Andrew Fechner, Diane Haltigan
5842, 2010-01-26, Andrew Fechner, Rajeev Gorowara, Anna Tschetter
5843, 2010-01-27, Anna Tschetter, Kelly Lathrop, James Poulos
5844, 2010-01-28, James Poulos, Matt Perez, Rebecca Dixon
5845, 2010-01-29, Rebecca Dixon, Francie Futterman, Jordan Piel
5856, 2010-02-15, Rebecca Dixon, Gillian Mabrey, Yevgeny Shrago
5857, 2010-02-16, Yevgeny Shrago, Jeremy Apsley, Christy Brown
5858, 2010-02-17, Jeremy Apsley, Mayank Keshaviah, Elizabeth Galoozis
5860, 2010-02-19, Elizabeth Galoozis, Lisa Dengate, Pablo Garcia
5861, 2010-02-22, Elizabeth Galoozis, Ginny Bartlett, Matt MacGregor
5862, 2010-02-23, Ginny Bartlett, Tom Toce, Stewart Yeargin
5863, 2010-02-24, Tom Toce, Graham Norris, Leslie Hurd
5864, 2010-02-25, Tom Toce, Rhonda Scarborough, Ben Auer
5865, 2010-02-26, Ben Auer, Ashok Bhaskar, Kori Tyler
5866, 2010-03-01, Ben Auer, Anne Damon, Amy Tyszkiewicz
5867, 2010-03-02, Amy Tyszkiewicz, Jesse Achtenberg, Julia Brown
5868, 2010-03-03, Jesse Achtenberg, Jordan Brand, Suzanne Tetreault
5869, 2010-03-04, Jordan Brand, Vijay Balse, Ann Rusthoven
5870, 2010-03-05, Vijay Balse, Todd Aiello, Miriam Carson
5871, 2010-03-08, Vijay Balse, Kirby Nelson, Karen Hoffman
5872, 2010-03-09, Vijay Balse, Becki Norris, Shelby Sadler
5873, 2010-03-10, Vijay Balse, Cyd Musni, Kyle Mathews
5874, 2010-03-11, Cyd Musni, Leslie Sommer, Ryan Stander
5875, 2010-03-12, Cyd Musni, Robert Knecht Schmidt, Sarah Rubin
5876, 2010-03-15, Robert Knecht Schmidt, Rachel Pildis, Nick Gorski
5877, 2010-03-16, Rachel Pildis, Jayson Johnson, Amanda Baber
5878, 2010-03-17, Amanda Baber, Jessica Shafer, Jim Banks
5880, 2010-03-19, Jim Banks, Sarah Bright, Kristian Zoerhoff
5881, 2010-03-22, Kristian Zoerhoff, Jonathan Sanchez, Lisa Horowitz
5882, 2010-03-23, Kristian Zoerhoff, Regina Robbins, Colin McLain
5883, 2010-03-24, Regina Robbins, Tatiana Walton, Derek Honoré
5884, 2010-03-25, Regina Robbins, Susan Malmo, Sean Burns
5885, 2010-03-26, Regina Robbins, Kerry Smith, Huat Lim
5886, 2010-03-29, Regina Robbins, Manny Maldonado III, Melissa Kowalski
5887, 2010-03-30, Manny Maldonado III, Stacy Braverman, Emily Cloyd
5888, 2010-03-31, Stacy Braverman, Pat Garahan, Matt Drury
5889, 2010-04-01, Matt Drury, Ken Burke, Jessica Trudeau
5890, 2010-04-02, Jessica Trudeau, Laura Hughes, Gary Gambino
5891, 2010-04-05, Laura Hughes, Brandon Hathaway, Nancy West
5892, 2010-04-06, Brandon Hathaway, David Hoskins, Emily Bryk
5893, 2010-04-07, Brandon Hathaway, Karla Ruksys, Conor Collins
5894, 2010-04-08, Karla Ruksys, Marv Peña, Morgan Saxby
5895, 2010-04-09, Morgan Saxby, Sarah Sumadi, Jack Aponte
5896, 2010-04-12, Morgan Saxby, Debbie Russell, Amanda Lahan
5897, 2010-04-13, Morgan Saxby, Arthur Christy, Andrew Sidden
5898, 2010-04-14, Arthur Christy, Ian Silverman, Charlotte Hotchkiss
5901, 2010-04-19, Ian Silverman, Ken Starnes, Elizabeth Richards
5902, 2010-04-20, Ken Starnes, Amy Wilson, Rick Reed
5903, 2010-04-21, Amy Wilson, Phil Bucska, Patsy Chrysson
5904, 2010-04-22, Phil Bucska, Hilary Caws-Elwitt, Chris Staaf
5905, 2010-04-23, Phil Bucska, Kathy Kenny, Carl Saras
5906, 2010-04-26, Kathy Kenny, Gabe Hernandez, Randall Johnson
5907, 2010-04-27, Randall Johnson, Megan Kardine, Brett Garner
5908, 2010-04-28, Randall Johnson, Buddy Wright, Alexandra Helprin
5909, 2010-04-29, Buddy Wright, Linda Smith, Robin Poché
5910, 2010-04-30, Buddy Wright, Antoinette Aubert, Shubha Ghosh
5926, 2010-05-24, Buddy Wright, Jenna Strickland, Gordon Purcell
5927, 2010-05-25, Buddy Wright, Amy Watts, Tom LaPorta
5928, 2010-05-26, Tom LaPorta, Arv Reddy, Colleen Kennedy
5929, 2010-05-27, Tom LaPorta, Bill Benison, Nancy Williams
5930, 2010-05-28, Tom LaPorta, Aaron Ammerman, Elizabeth Schmitt
5931, 2010-05-31, Aaron Ammerman, Sally Ronald, Cathy Melocik
5932, 2010-06-01, Cathy Melocik, Shaun Desmond, Cheryl Parrott
5933, 2010-06-02, Cathy Melocik, Gerry Cuddyer, Jeff Johnson
5934, 2010-06-03, Jeff Johnson, Greg Lyon, Susan Thatcher
5935, 2010-06-04, Jeff Johnson, Felicia Ko, J.R. Lind
5936, 2010-06-07, J.R. Lind, Becky Henderson, Joshua Weiss
5937, 2010-06-08, J.R. Lind, Peter Hall, Jessica Freeman
5938, 2010-06-09, Peter Hall, Kyle Hutchinson, Dan Katz
5939, 2010-06-10, Kyle Hutchinson, Marty Scott, Ilana Cohen
5940, 2010-06-11, Marty Scott, Ken Eberle, Jennifer Roberson
5941, 2010-06-14, Marty Scott, Marianthe Colakis, Mark Passerrello
5942, 2010-06-15, Marty Scott, Jonah Busch, Anne Triolo
5943, 2010-06-16, Anne Triolo, Paul Kursky, Laura White
5944, 2010-06-17, Paul Kursky, Peggy Enright, Matt Cavanaugh
5945, 2010-06-18, Paul Kursky, Jon Zerolnick, Katherine Thompson
5946, 2010-06-21, Paul Kursky, Eric Rau, Terrill Wilkins
5947, 2010-06-22, Paul Kursky, Chris Vermilion, Autumn Haag
5948, 2010-06-23, Paul Kursky, Sharyle Doherty, Joey Genereux
5949, 2010-06-24, Joey Genereux, Janet Bradlow, Grant Colvin
5950, 2010-06-25, Janet Bradlow, Lisa Cerrato, Matthew Levine
5951, 2010-06-28, Janet Bradlow, Katie Bruton, Stefanie Small
5952, 2010-06-29, Janet Bradlow, Christopher Scheeren, Steven Milton
5953, 2010-06-30, Steven Milton, Jeff Gordon, Cara Colville
5954, 2010-07-01, Steven Milton, Kristina Glithero, Dave Edwards
5955, 2010-07-02, Dave Edwards, Aaron Wicks, Kim Platnick
5961, 2010-07-12, Aaron Wicks, Barbara Gayle, Saad Hasan
5962, 2010-07-13, Saad Hasan, Anne Anglim, Van Lane
5963, 2010-07-14, Van Lane, Victoria Rduch, Chris Dungan
5964, 2010-07-15, Van Lane, Neal Eggeson, Bryn Reinecke
5965, 2010-07-16, Van Lane, John Krizel, Leslie Williams
5966, 2010-07-19, John Krizel, Michael Muller, Susan Neuffer
5967, 2010-07-20, John Krizel, Gene Beed, Donna Gottlieb
5968, 2010-07-21, John Krizel, Sarah Minson, Tom Alexander
5969, 2010-07-22, John Krizel, Dan Highlands, Alison Stone Roberg
5970, 2010-07-23, Alison Stone Roberg, Joe Gallagher, Rich Baker
5971, 2010-07-26, Alison Stone Roberg, John Cunningham, Pamela Nelson
5972, 2010-07-27, Alison Stone Roberg, Vince Femenella, Nora Corrigan
5973, 2010-07-28, Nora Corrigan, Jen Fick, Alyssa Morgan
5974, 2010-07-29, Jen Fick, Markus Iturriaga, Meg Miller
5975, 2010-07-30, Meg Miller, J.D. Lowry, James Richardson
5976, 2010-09-13, Meg Miller, Scott Wells, Roger Craig
5977, 2010-09-14, Roger Craig, Tony Fan, Mandy Strine
5978, 2010-09-15, Roger Craig, Kevin Knudson, Katie Ganfield
5979, 2010-09-16, Roger Craig, Les Taub, Ruth Anne Stevens-Klitz
5980, 2010-09-17, Roger Craig, Shaama Pandya, Ryan Hedlund
5981, 2010-09-20, Roger Craig, Mary Keating, Marisa Tam
5982, 2010-09-21, Roger Craig, Matt Martin, Jelisa Castrodale
5983, 2010-09-22, Jelisa Castrodale, Destiny Lilly, Russ Porter
5984, 2010-09-23, Russ Porter, DJ Schepker, Kara Spak
5985, 2010-09-24, Kara Spak, Hillary Janikula, Lyssette Flinchbaugh
5986, 2010-09-27, Kara Spak, Beth Eckerd, Robert Villarreal
5987, 2010-09-28, Kara Spak, David Zack, Phyllis Grayson
5988, 2010-09-29, Kara Spak, Claire Bea, Molly Zeigler
5989, 2010-09-30, Kara Spak, Tegan Brown, Mark McDonnell
5990, 2010-10-01, Mark McDonnell, Emily Jusino, Adam Podber
5991, 2010-10-04, Emily Jusino, Lois Petzold, Don Meals
5992, 2010-10-05, Don Meals, Kristen Schroeder, James Brown
5993, 2010-10-06, Don Meals, Kelly Moore, Peter Landesman
5994, 2010-10-07, Don Meals, Mike Hodel, Sarah Rabin Spira
5995, 2010-10-08, Mike Hodel, Alli Johnson, Brad Rodriguez
5996, 2010-10-11, Mike Hodel, Dylan Payne, Carol Denny
5997, 2010-10-12, Carol Denny, Suzanne Rorick, Tim Campos
5998, 2010-10-13, Suzanne Rorick, Sara Wilkinson, Terry Andrews
5999, 2010-10-14, Sara Wilkinson, Theo McLauchlin, Anjali Chelliah Sawe
6000, 2010-10-15, Sara Wilkinson, Robert Yowell, Liz Tracey
6001, 2010-10-18, Sara Wilkinson, Matt DeTura, Paula Currall
6002, 2010-10-19, Matt DeTura, Jon Golbe, Stephanie Bethel
6003, 2010-10-20, Matt DeTura, Megan Griffiths, Tommy Jordan
6004, 2010-10-21, Matt DeTura, Mike Wilson, Kathleen Mikulis
6005, 2010-10-22, Kathleen Mikulis, Ari Stern, Mary Van Tyne
6006, 2010-10-25, Ari Stern, Reggie LaFond, Pam Jones-Pigott
6007, 2010-10-26, Pam Jones-Pigott, Laura Spadanuta, Jesse Cuevas
6008, 2010-10-27, Jesse Cuevas, Bert Rubini, Sarah Whitaker
6009, 2010-10-28, Jesse Cuevas, Barbara Brown, George Villarreal
6010, 2010-10-29, Jesse Cuevas, Ricky Kreitner, Marie Braden
6011, 2010-11-01, Marie Braden, Molly Adams, Silvio Menzano
6012, 2010-11-02, Silvio Menzano, Dave Ellis, Jocelyn Casser
6013, 2010-11-03, Dave Ellis, Anne McFadden, Vito Cortese
6014, 2010-11-04, Vito Cortese, Rony Josaphat, Jennifer Hill
6015, 2010-11-05, Vito Cortese, John Wen, Jeanne Breen
6026, 2010-11-22, Vito Cortese, Aimee Slater, George Tsuji
6027, 2010-11-23, George Tsuji, Bob Kennedy, Megan Cornell
6028, 2010-11-24, Bob Kennedy, Rebecca O'Brien, Stephanie Gumble
6029, 2010-11-25, Bob Kennedy, Matthew Warren, Laura Button
6030, 2010-11-26, Laura Button, Kemi James, Judy Shewmake
6031, 2010-11-29, Judy Shewmake, Kristin Anderson, Charlie Penrod
6032, 2010-11-30, Charlie Penrod, Tom Zamojcin, Allie Hagan
6033, 2010-12-01, Tom Zamojcin, Ariel Schneider, Terence Scroope
6034, 2010-12-02, Ariel Schneider, Kate Reilly, Francesca Huemer Kelly
6035, 2010-12-03, Ariel Schneider, Andy Holt, Josh Powell
6036, 2010-12-06, Josh Powell, Christina Barley, Will Durbin
6037, 2010-12-07, Josh Powell, Rich Zayatz, Jamie O'Hagin
6038, 2010-12-08, Josh Powell, Adam Bibler, Kate Palladino
6039, 2010-12-09, Adam Bibler, Liz Maziarz, Steve Meer
6040, 2010-12-10, Liz Maziarz, Sandra McClellan, Eugene Henderson
6041, 2010-12-13, Sandra McClellan, Jonathan Corbblah, Keri McConaghy
6042, 2010-12-14, Jonathan Corbblah, Judy Arnold, Tom Nissley
6043, 2010-12-15, Tom Nissley, Alexis Hawley, Anthony Flores
6044, 2010-12-16, Tom Nissley, Tim Klein, Jen Huff
6045, 2010-12-17, Tom Nissley, Nina Kiekhaefer, Teresa Lane
6046, 2010-12-20, Tom Nissley, Julia Carlis, Bob Fulmer
6047, 2010-12-21, Tom Nissley, Danni Steiner, Andrew Sullivan
6048, 2010-12-22, Tom Nissley, Ester Murdukhayeva, Dennis Loo
6049, 2010-12-23, Tom Nissley, Corey York, Samantha Barry
6050, 2010-12-24, Tom Nissley, Marissa Goldsmith, Chris Quin
6051, 2010-12-27, Marissa Goldsmith, Andrea Barnes, Ryan Vogt
6052, 2010-12-28, Marissa Goldsmith, Alice Jackson, Anthony Curtis
6053, 2010-12-29, Marissa Goldsmith, Raghuveer Mukkamalla, Ellen Kimmel
6054, 2010-12-30, Ellen Kimmel, Whitney Manzo, Matt Creamer
6055, 2010-12-31, Ellen Kimmel, Allysen Meijer, Lyn Thomas
6056, 2011-01-03, Lyn Thomas, Genaro Lopez, Annemarie Brentrup
6057, 2011-01-04, Genaro Lopez, Alex Marchyshyn, Steve Gratz
6058, 2011-01-05, Steve Gratz, Erik Lang, Melissa Nilles
6059, 2011-01-06, Steve Gratz, Dan Jensen, Maureen Abell
6060, 2011-01-07, Dan Jensen, Dana Gresko, Gabe Perez-Giz
6061, 2011-01-10, Dan Jensen, Michael Rose, Margaret Murphy
6062, 2011-01-11, Dan Jensen, Justin Braganza, Sally O'Rourke
6063, 2011-01-12, Sally O'Rourke, Tom Toal, Elisabeth Karlin
6064, 2011-01-13, Tom Toal, Anthony Fox, Sarah Olson
6065, 2011-01-14, Anthony Fox, John McLean, Matt McQueary
6066, 2011-01-17, Anthony Fox, Claudia Kasvin, Gerard Coletta
6067, 2011-01-18, Anthony Fox, Ali Binazir, Carrie Oken
6068, 2011-01-19, Anthony Fox, Margaret Metcalf, Jeff Gorham
6069, 2011-01-20, Jeff Gorham, Julie Wolfson, Scott Harris
6070, 2011-01-21, Scott Harris, Sandy Hollimon, Amanda Sonmor
6071, 2011-01-24, Amanda Sonmor, Josh Magri, Elaine Thompson
6072, 2011-01-25, Amanda Sonmor, Abie Hadjitarkhani, Gitta Neufeld
6073, 2011-01-26, Gitta Neufeld, Tom Jennings, Ryan Nelson
6074, 2011-01-27, Tom Jennings, Lisa Dvorak, Kara French
6075, 2011-01-28, Lisa Dvorak, Doug Payne, Eureka Nutt
6076, 2011-01-31, Eureka Nutt, Jean Dupon, Johnny Marigliano
6077, 2011-02-01, Eureka Nutt, Molly Rosenbusch, Ron Roberts
6078, 2011-02-02, Molly Rosenbusch, Fred Cofone, Mike Huijon
6079, 2011-02-03, Fred Cofone, Mai Do-Burrous, Marty Christy
6080, 2011-02-04, Fred Cofone, Roger Mueller-Kim, Kristi Springer
6081, 2011-02-07, Roger Mueller-Kim, Paul Wampler, Erin Beach
6082, 2011-02-08, Paul Wampler, Rachel LeCroy, Keagan Baker
6083, 2011-02-09, Paul Wampler, Daniel Cohen, Sean Priest
6084, 2011-02-10, Paul Wampler, Betsy Stephenson, Milind Kulkarni
6085, 2011-02-11, Paul Wampler, Sarah Monteith, Kate Rowland
6099, 2011-03-03, Kate Rowland, Cecilia Boudreau, Carl Bradshaw
6100, 2011-03-04, Carl Bradshaw, Sara Lichterman, Mark Pudlow
6101, 2011-03-07, Carl Bradshaw, Mike Nelson, Dawn Hart
6102, 2011-03-08, Mike Nelson, Joe Mastroeni, Meg Khavari
6103, 2011-03-09, Mike Nelson, Harley Savage, Quinn McDonald
6104, 2011-03-10, Quinn McDonald, Tim Maas, Evan Bastian
6105, 2011-03-11, Tim Maas, Mary McGlynn, Katie Sowder
6106, 2011-03-14, Katie Sowder, Ethan Dougherty, Lori Cain
6107, 2011-03-15, Lori Cain, Kristi Myers, Tom Kunzen
6108, 2011-03-16, Tom Kunzen, Rebecca Rogers, Peter Perigo
6109, 2011-03-17, Tom Kunzen, Zack Azzam, Mary Linnenbringer
6110, 2011-03-18, Tom Kunzen, Christine Varnado, Duncan Stewart
6111, 2011-03-21, Tom Kunzen, Stephen Huey, Erin Maxwell
6112, 2011-03-22, Tom Kunzen, Barry Cohen, Megan Barnes
6113, 2011-03-23, Megan Barnes, Jamie Santo, Janet Russell
6114, 2011-03-24, Megan Barnes, Michael Brown, Connie McClung
6115, 2011-03-25, Megan Barnes, Eric Sebert, Julie Ross Godar
6116, 2011-03-28, Julie Ross Godar, Trey McCraw, Denise O'Connor
6117, 2011-03-29, Denise O'Connor, Jennifer Carlo, Ted Sitting Crow Garner
6118, 2011-03-30, Ted Sitting Crow Garner, Ellen Dickens, Paul Cheng
6119, 2011-03-31, Ellen Dickens, J.D. Lopez, Amanda Wallwin
6120, 2011-04-01, Amanda Wallwin, Mark Samburg, Christopher Short
6121, 2011-04-04, Christopher Short, Ko Otaka, Tom Moosbrugger
6122, 2011-04-05, Christopher Short, Cory Biggs, Cindy Peterson
6123, 2011-04-06, Christopher Short, Connie Loren, Beth Ford Roth
6124, 2011-04-07, Christopher Short, Mickey McLaurin, Helen Hostetter
6125, 2011-04-08, Christopher Short, Kimberly Sheppard, Anselm Chen
6126, 2011-04-11, Christopher Short, Heather Timberlake, Tim Kresowik
6127, 2011-04-12, Tim Kresowik, Stephanie Munroe, Daniel Cohen
6128, 2011-04-13, Tim Kresowik, Michelle Franklin, Sara Heard
6129, 2011-04-14, Sara Heard, Annie Douglass, Miguel Ruiz
6130, 2011-04-15, Sara Heard, Jim Fenton, Amy Fulton Stout
6131, 2011-04-18, Sara Heard, Andrew Fuller, John Paul Manuel
6132, 2011-04-19, Sara Heard, Jason Rhode, Mary Mitchell
6133, 2011-04-20, Mary Mitchell, Kirsten Ruemenapp, Robin Woolsey
6134, 2011-04-21, Robin Woolsey, Brian Meacham, Beth Miller
6135, 2011-04-22, Brian Meacham, KC Frodyma, Nick Cohen
6136, 2011-04-25, Brian Meacham, Emily Barkley-Levenson, Chuck Narikiyo
6137, 2011-04-26, Brian Meacham, Sarah Canfield Fuller, Andy Levin
6138, 2011-04-27, Brian Meacham, Denis Theriault, Virginia Ogozalek
6139, 2011-04-28, Denis Theriault, Joe McKee, Maya Zwerdling
6140, 2011-04-29, Joe McKee, Grant Wing, Ian Pickus
6151, 2011-05-16, Joe McKee, Denise Troy, Joyce Newmark
6152, 2011-05-17, Joyce Newmark, Lisa Bloomberg, Ramesh Mantha
6153, 2011-05-18, Lisa Bloomberg, Gary Rosche, Flora Peir
6154, 2011-05-19, Lisa Bloomberg, Matt Neville, Beverly Jones
6155, 2011-05-20, Matt Neville, Adam Kapp, Tracey Davidson
6156, 2011-05-23, Matt Neville, Cindy Clark, Joseph Tambornino
6157, 2011-05-24, Matt Neville, Tom Brown, Gay Haubner
6158, 2011-05-25, Tom Brown, Amy Ruberg, James Ma
6159, 2011-05-26, Tom Brown, Chloe Horning, Carl Aveni
6160, 2011-05-27, Chloe Horning, Renee Huff, Monica Iyer
6161, 2011-05-30, Monica Iyer, Roberta Candalino, Matt Larson
6162, 2011-05-31, Matt Larson, Ty Cone, Jennifer Najarian
6163, 2011-06-01, Ty Cone, Michael Philpy, Maggie Berndt
6164, 2011-06-02, Michael Philpy, Steve Tipton, Jericho Saria
6165, 2011-06-03, Jericho Saria, Patrick Stubbins, Nancy Hale
6166, 2011-06-06, Jericho Saria, Joanna Liff, Sam Meyer
6167, 2011-06-07, Sam Meyer, Lindsey Peterson, Crystal Leonard
6168, 2011-06-08, Sam Meyer, Tim Kuehn, Chris Hauck
6169, 2011-06-09, Tim Kuehn, Mary Anna Martell, Makeen Huda
6170, 2011-06-10, Mary Anna Martell, Amy Larimer, Ben Sack
6171, 2011-06-13, Amy Larimer, Nick Condon, Daniel Trudeau
6172, 2011-06-14, Nick Condon, LuEllen Buhrman, Jeff Fleischer
6173, 2011-06-15, Nick Condon, John Mingey, Michael Vlach
6174, 2011-06-16, Nick Condon, Stewart Tuttle, Lisa Longo
6175, 2011-06-17, Stewart Tuttle, Steve Sobelman, Danielle Harlow
6176, 2011-06-20, Danielle Harlow, Sam Fleming, Jay Rhee
6177, 2011-06-21, Jay Rhee, Julianna Suchard, Scott Goldstein
6178, 2011-06-22, Jay Rhee, Kartik Venguswamy, Kate Sparich
6179, 2011-06-23, Jay Rhee, Andrew Dobbs, Pat Connor
6180, 2011-06-24, Jay Rhee, Marc Tracy, Elaine Garrett
6181, 2011-06-27, Jay Rhee, Adam Marshall, Dan Carroll
6182, 2011-06-28, Adam Marshall, Chris Clayton, Polly Ruf
6183, 2011-06-29, Adam Marshall, Jeff Amoros, Dolores DeStefano
6184, 2011-06-30, Jeff Amoros, Meg Price, Rachel Winer
6185, 2011-07-01, Rachel Winer, Josh Cabat, Ben Wong
6191, 2011-07-11, Rachel Winer, Damian Yu, Christopher Stephens
6192, 2011-07-12, Damian Yu, Ian Leggin, Judy Neuwirth
6193, 2011-07-13, Damian Yu, Sarah Powell, Paul Barbour
6194, 2011-07-14, Paul Barbour, Kathleen Lee, Janet Vigen Levy
6195, 2011-07-15, Kathleen Lee, Mark Runsvold, Aric Wu
6196, 2011-07-18, Mark Runsvold, Karawan Meade, Jerry Hou
6197, 2011-07-19, Mark Runsvold, Christine Janson, Tom Vaughan
6198, 2011-07-20, Mark Runsvold, Maria Boyland, Zac Youngblood
6199, 2011-07-21, Mark Runsvold, Samer Ismail, Brian McEntee
6200, 2011-07-22, Brian McEntee, Linda Percy, Tim Wagner
6201, 2011-07-25, Linda Percy, Edgar Mihelic, Maggie Diamond
6202, 2011-07-26, Linda Percy, Graig Zethner, Andrew Bach
6203, 2011-07-27, Linda Percy, Amy George, Ryan Fox
6204, 2011-07-28, Ryan Fox, Justin Sausville, Cathy Markwiese
6205, 2011-07-29, Justin Sausville, Marty Butterick, Lisa McDermott
6206, 2011-09-19, Justin Sausville, Glenn Edwards, Jane Stimpson
6207, 2011-09-20, Justin Sausville, Alex Liteplo, Ken Herrera
6208, 2011-09-21, Justin Sausville, Patrick Sweaney, Beth Hermann
6209, 2011-09-22, Justin Sausville, Anne Kenney Chaplin, Brian Lehman
6210, 2011-09-23, Justin Sausville, Amit Kurlekar, Jessica Burr
6211, 2011-09-26, Amit Kurlekar, Matt Douma, Ellen Mizio
6212, 2011-09-27, Matt Douma, Joe Iriana, Susan Miller
6213, 2011-09-28, Matt Douma, Sergio Llorian, Libby Nelson
6214, 2011-09-29, Sergio Llorian, Lindsy Lassere, Chris Fleitas
6215, 2011-09-30, Chris Fleitas, Rob Landolfi, Donna Laux
6216, 2011-10-03, Chris Fleitas, Joon Pahk, Aleisa Farrington
6217, 2011-10-04, Joon Pahk, Elaine Ricci, Megan Johnson
6218, 2011-10-05, Joon Pahk, Katie Baker, Daniel Okobi
6219, 2011-10-06, Joon Pahk, Ted Simmons, Franny Howes
6220, 2011-10-07, Joon Pahk, Bret Jacobs, Adam Perrotta
6221, 2011-10-10, Joon Pahk, Hannah Wachs, Jared Balkman
6222, 2011-10-11, Joon Pahk, Michael Stewart, Ashley Shannon
6223, 2011-10-12, Joon Pahk, Katie Proctor, Leigh Wishner
6224, 2011-10-13, Katie Proctor, Drew Denton, Liz Good
6225, 2011-10-14, Katie Proctor, Megan Benitz, Joe Koster
6226, 2011-10-17, Joe Koster, Lanny Timan, Jeff Dufour
6227, 2011-10-18, Lanny Timan, Ray Crosby, Liz Greenwood
6228, 2011-10-19, Lanny Timan, Liz Greenwood, Lloyd Caesar
6229, 2011-10-20, Lloyd Caesar, Jessie Christensen, Jay Peterson
6230, 2011-10-21, Jay Peterson, Heather Anstaett, Balaji Narain
6231, 2011-10-24, Balaji Narain, Francisco Maldonado-Ramirez, Laura Bulkin
6232, 2011-10-25, Balaji Narain, Gabor Vari, Jennifer Dockter
6233, 2011-10-26, Gabor Vari, Ryan McCune, Abigail Gardner
6234, 2011-10-27, Gabor Vari, Sunny Stalter, Alex Johnson
6235, 2011-10-28, Sunny Stalter, Helaine Greenfeld, John Jordan
6236, 2011-10-31, Sunny Stalter, Gina Harris, Evan Sandman
6237, 2011-11-01, Evan Sandman, Dave Burnstein, Emily Gifford
6248, 2011-11-16, Emily Gifford, Ellen Lewis, Will Valverde
6249, 2011-11-17, Ellen Lewis, Matt Andelman, Glenn Sullivan
6250, 2011-11-18, Glenn Sullivan, Morgan Polikoff, Mellissa Ahmed
6251, 2011-11-21, Morgan Polikoff, Francis Lansangan, Caroline Wilkins
6252, 2011-11-22, Francis Lansangan, Peter Jury, Abby Drwecki
6253, 2011-11-23, Francis Lansangan, Steven Maio, Katherine Philbin
6254, 2011-11-24, Francis Lansangan, Sean McGuire, Ann Thurlow
6255, 2011-11-25, Ann Thurlow, Kendra Anspaugh, James Ruchala
6256, 2011-11-28, Kendra Anspaugh, Clayton Hanson, Patti Clements
6257, 2011-11-29, Kendra Anspaugh, Kiran Kedlaya, Mary Redling
6258, 2011-11-30, Kiran Kedlaya, Jan Zasowski, Tim Gray
6259, 2011-12-01, Jan Zasowski, Logan Schultz, Gillian DiPietro
6260, 2011-12-02, Jan Zasowski, Bhibha Das, Suzanne Judson-Whitehouse
6261, 2011-12-05, Bhibha Das, Scott Russell, Brendan Barnwell
6262, 2011-12-06, Bhibha Das, Rich Beimer, Julia Kozicki
6263, 2011-12-07, Julia Kozicki, Tony Hightower, Jennifer Bernstein
6264, 2011-12-08, Tony Hightower, William Castañeda, Dan Kull
6265, 2011-12-09, William Castañeda, Drew Bayers, Nicole Willson
6266, 2011-12-12, Drew Bayers, Ellen Tabor, Chuck Rezac
6267, 2011-12-13, Chuck Rezac, Gina Bernal, Boomie Aglietti
6268, 2011-12-14, Boomie Aglietti, Jennifer Hills, Matt Harriss
6269, 2011-12-15, Boomie Aglietti, Silas Crawford, Beth Watkins
6270, 2011-12-16, Beth Watkins, Jason Keller, Leslie Hamilton
6271, 2011-12-19, Jason Keller, Kathleen Schultz, Derek Schuld
6272, 2011-12-20, Jason Keller, Karen Hedlund, Doug Davies
6273, 2011-12-21, Jason Keller, Drew Tompkins, Janemarie Cloutier
6274, 2011-12-22, Jason Keller, Niall Prendergast, Isaac Patterson
6275, 2011-12-23, Jason Keller, Sara Plant, Erin Arlow
6276, 2011-12-26, Jason Keller, Andrea Bornschlegel, Jack McClintock
6277, 2011-12-27, Jason Keller, Bill Moreau, Andrew Robinson
6278, 2011-12-28, Jason Keller, Patrick Rostock, Lesley Tsina
6279, 2011-12-29, Jason Keller, Jennifer Green, Dave Leach
6280, 2011-12-30, Dave Leach, Lisa Spardel-Krol, Tom Vanderbilt
6281, 2012-01-02, Dave Leach, Art Hilliker, Elizabeth Weichel
6282, 2012-01-03, Dave Leach, Sally Sommers Smith, Nicholas Campiz
6283, 2012-01-04, Dave Leach, Nicholas Campiz, Jaldhar Vyas
6284, 2012-01-05, Dave Leach, Mark Rupp, Amy Ludwig
6285, 2012-01-06, Dave Leach, Molly Dahlberg, Dan McShane
6286, 2012-01-09, Dan McShane, Sean Norris, Julie Podlesni
6287, 2012-01-10, Dan McShane, Bryan Barnett, Jennifer Osorio
6288, 2012-01-11, Dan McShane, Katy Stigers, Vinayak Thiagarajan
6289, 2012-01-12, Dan McShane, Brandon Libby, Stephanie Walker
6290, 2012-01-13, Brandon Libby, Cindy Conaway, Preston Nicholson
6291, 2012-01-16, Brandon Libby, Betsy Schroeder, Mike Hatch
6292, 2012-01-17, Betsy Schroeder, Daniel Hodge, Amy Stephenson
6293, 2012-01-18, Amy Stephenson, Debra McGuire, Zach May
6294, 2012-01-19, Amy Stephenson, Lynn Hammerlund, Naved Sheikh
6295, 2012-01-20, Lynn Hammerlund, Russell Howes, Bob Powell
6296, 2012-01-23, Bob Powell, Kirby Burnett, Molly Newman
6297, 2012-01-24, Kirby Burnett, Sean O'Connor, Elizabeth Edwards
6298, 2012-01-25, Kirby Burnett, Taylor Cope, Christen Lee
6299, 2012-01-26, Taylor Cope, Rhonda Hammons, Brendan Graham
6300, 2012-01-27, Brendan Graham, Emily Kelly, Bruce Vale
6301, 2012-01-30, Brendan Graham, Kate Jeracki, Danny Parra
6302, 2012-01-31, Danny Parra, Patrick Morrison, Ellen Ciompi
6323, 2012-02-29, Patrick Morrison, Sarah Edwards, Michael McCall
6324, 2012-03-01, Patrick Morrison, Susannah Rosenblatt, Andrew Knebel
6325, 2012-03-02, Patrick Morrison, David Gard, Annette Todd
6326, 2012-03-05, David Gard, Nina Stanton, Tony Grey
6327, 2012-03-06, David Gard, Laura Whittle, Ben Parks-Stamm
6328, 2012-03-07, David Gard, Stephen Shaw, Annie Lyon
6329, 2012-03-08, David Gard, Vijay Iyer, Jessamine Price
6330, 2012-03-09, Jessamine Price, Galen Benshoof, Marion Baumgarten
6331, 2012-03-12, Jessamine Price, Richard Elepano, Reid Rodgers
6332, 2012-03-13, Jessamine Price, Patrick Antle, Sonia Saraiya
6333, 2012-03-14, Patrick Antle, Rebecca Blustein, Michael Gurshtein
6334, 2012-03-15, Michael Gurshtein, Sue Anderson, John Erler
6335, 2012-03-16, John Erler, Sharla Zwirek, Hannah Spector
6336, 2012-03-19, Hannah Spector, Alex Wright, Kyle Roll
6337, 2012-03-20, Alex Wright, Melanie Spratford, Vince Gatton
6338, 2012-03-21, Melanie Spratford, Cathy Guiles, Greg Bentley
6339, 2012-03-22, Cathy Guiles, Nick Bulum, Nancy Nakayama
6340, 2012-03-23, Cathy Guiles, Dennis Wright, Eileen O'Toole
6341, 2012-03-26, Dennis Wright, Mithun Kamath, Margie Cohen
6342, 2012-03-27, Margie Cohen, Beau Henson, Chuck Ettelson
6343, 2012-03-28, Beau Henson, Catie Fletcher, Jeanie Kenkel
6344, 2012-03-29, Beau Henson, Jay Ben Markson, Richie Rodriguez
6345, 2012-03-30, Beau Henson, Sarah Curtis, Ruth Robbins
6346, 2012-04-02, Sarah Curtis, Elisabeth Carrel, Randy Cauthen
6347, 2012-04-03, Elisabeth Carrel, Tamara Tatum-Broughton, Joey Falco
6348, 2012-04-04, Joey Falco, Jesse Tow, Michael Tvaruzka
6349, 2012-04-05, Joey Falco, Emily Garber, John Sellers
6350, 2012-04-06, Joey Falco, Bing Huo, Lisa Lyons
6351, 2012-04-09, Bing Huo, Doug Lloyd, Anne Raybon
6352, 2012-04-10, Doug Lloyd, Amy Ketterling, Maurice Ayache
6353, 2012-04-11, Amy Ketterling, Lindsay Reese, Sean Hansen
6354, 2012-04-12, Sean Hansen, Judy Nichols, Megan Davenport
6355, 2012-04-13, Judy Nichols, Peter Allen, Cat Still
6356, 2012-04-16, Judy Nichols, Michelle LaLonde, Trevor Bryan
