4812, 2005-07-05, Teresa Grasso, John Colterman, David Madden
4813, 2005-07-06, David Madden, Michael Segal, Cheryl Bush
4814, 2005-07-07, David Madden, Jim O'Malley, Jamie Ball
4815, 2005-07-08, David Madden, Kate Morrical, Matt Barakat
4816, 2005-07-11, David Madden, Annemarie Gallagher, Jessica Schreader
4817, 2005-07-12, David Madden, Kem Herding, Charles Martin
4818, 2005-07-13, David Madden, Audrey Golub, Evan Kleber
4819, 2005-07-14, David Madden, Kate Brogan, Jennifer Burrus
4820, 2005-07-15, David Madden, Mark Murray, Karen Arciero
4821, 2005-07-18, David Madden, Brian Pearson, Laurie Parker
4822, 2005-07-19, David Madden, Richard Bernstein, Margaret Rhodes
4823, 2005-07-20, David Madden, Oscar Avila, Ellyn Ritterskamp
4824, 2005-07-21, David Madden, Aaron Schnier, Britney Harris
4825, 2005-07-22, David Madden, Dan Tick, Maya Kobersy
4826, 2005-09-12, David Madden, Catie Camille, Willy Jay
4827, 2005-09-13, David Madden, Jennifer Buermann, Matthew Luter
4828, 2005-09-14, David Madden, Sharon Rupe, John Shivers
4829, 2005-09-15, David Madden, Michael Shirts, Martha McKinney
4830, 2005-09-16, David Madden, Eric Rosen, Janet Kaufman
4831, 2005-09-19, David Madden, Steve Kaltenbaugh, Victoria Groce
4832, 2005-09-20, Victoria Groce, Stacey Swann, Ray Freson
4833, 2005-09-21, Ray Freson, Mike Leger, Carol Hager
4834, 2005-09-22, Mike Leger, Deborah Slattery, Chris Hartley
4835, 2005-09-23, Deborah Slattery, Andrew Segal, Heather Pharo
4836, 2005-09-26, Deborah Slattery, Monica Vidrio, Melissa Ingells
4837, 2005-09-27, Monica Vidrio, Caleb Whitaker, Andy Rosenberg
4838, 2005-09-28, Andy Rosenberg, Jeanie Kyle, Tom Streit
4839, 2005-09-29, Andy Rosenberg, Mark Barrett, Alison Beightol
4840, 2005-09-30, Mark Barrett, Will Hester, Elizabeth Randisi
4841, 2005-10-03, Elizabeth Randisi, Zeb Schobernd, Jason Richards
4842, 2005-10-04, Jason Richards, Susan Daniels, Thaddeus Grimes-Gruczka
4843, 2005-10-05, Jason Richards, Caren Chancey, Justin Porter
4844, 2005-10-06, Jason Richards, Helen Kaluzny, Brendan Beier
4845, 2005-10-07, Jason Richards, Ted Barnett, Melissa Prepster
4851, 2005-10-17, Melissa Prepster, Stuart Nadler, Paul Tavianini
4852, 2005-10-18, Melissa Prepster, Dominic Owen-Williams, Kim Strassburger
4853, 2005-10-19, Dominic Owen-Williams, Steve O'Connor, Katie Miltich
4854, 2005-10-20, Steve O'Connor, Lori Skelton, Bob Johnson
4855, 2005-10-21, Steve O'Connor, Paulette Beete, Amanda Traphagan
4856, 2005-10-24, Amanda Traphagan, John Kelly, Claire O'Brien
4857, 2005-10-25, John Kelly, Chris Jones, Diane Mettam
4858, 2005-10-26, Diane Mettam, Jeff Pandin, Susan Klak
4859, 2005-10-27, Jeff Pandin, Joey Bland, Jennifer Furlong
4860, 2005-10-28, Joey Bland, Alaric Smith, Laura Henne
4861, 2005-10-31, Joey Bland, Maria Wenglinsky, Steve Ostini
4862, 2005-11-01, Maria Wenglinsky, Jeremy Evans, Philip Huang
4863, 2005-11-02, Maria Wenglinsky, David Braxton, Leslie Burns-Dell'Acqua
4864, 2005-11-03, Maria Wenglinsky, Kingslea Bueltel, Jim Gilcreast
4865, 2005-11-04, Maria Wenglinsky, Shelley Fellner-Rosenberg, Kari Russ
4876, 2005-11-21, Maria Wenglinsky, Michael Cramer, Jeff Cuffee
4877, 2005-11-22, Michael Cramer, Jeanne McDougall, Bill MacDonald
4878, 2005-11-23, Bill MacDonald, Beth Chalecki, Scott Zimmerman
4879, 2005-11-24, Bill MacDonald, Ben Davis, Wendy Stancer
4880, 2005-11-25, Bill MacDonald, Robert J. Lee, Pat Godwin
4881, 2005-11-28, Bill MacDonald, Beth Doner, Vik Vaz
4882, 2005-11-29, Vik Vaz, Kelly Croissant, Deena Banks
4883, 2005-11-30, Vik Vaz, Josh Danson, Liz Lackey
4884, 2005-12-01, Vik Vaz, Jenn Carlson, Adam Weinstein
4885, 2005-12-02, Adam Weinstein, Michael Levitin, Glenda Niemiec
4886, 2005-12-05, Adam Weinstein, Todd Roshak, Vicky Stanton
4887, 2005-12-06, Vicky Stanton, Charles Bagot, Marianna Johnson
4888, 2005-12-07, Vicky Stanton, Christi Beard, James Quintong
4889, 2005-12-08, James Quintong, Michael Salerno, LeeAundra Temescu
4890, 2005-12-09, LeeAundra Temescu, Beth Klein, Elaine Henderson
4891, 2005-12-12, Elaine Henderson, Rich Way, Bryn Upton
4892, 2005-12-13, Rich Way, Amy Johnson, James Reeves
4893, 2005-12-14, Rich Way, Bill Crowley, Erin McGurgan
4894, 2005-12-15, Bill Crowley, Tim Ifill, Maria Kokiasmenos
4895, 2005-12-16, Maria Kokiasmenos, Kathy Reiff, Mark Levin
4896, 2005-12-19, Kathy Reiff, Brendan O'Connor, Laura McElfresh
4897, 2005-12-20, Laura McElfresh, Rob Klepadlo, Debbie Chuba
4898, 2005-12-21, Laura McElfresh, Karen Spinale, Jeff Lawrence
4899, 2005-12-22, Jeff Lawrence, Josh Yost, Lisa Loiselle
4900, 2005-12-23, Jeff Lawrence, Barbara Noyes, Peter Rubin
4901, 2005-12-26, Peter Rubin, Julie Reynolds, Bob McDonald
4902, 2005-12-27, Peter Rubin, Rex Babiera, Sharon Dorsey
4903, 2005-12-28, Rex Babiera, Leslie Hickey, Kevin Gomes
4904, 2005-12-29, Rex Babiera, Tom Kavanaugh, Keara Depenbrock
4905, 2005-12-30, Tom Kavanaugh, Robert Bethard, Lauren Dean
4906, 2006-01-02, Tom Kavanaugh, Joan Tosh, Jamie Hodari
4907, 2006-01-03, Tom Kavanaugh, James Calhoun, Leslie Birdwell
4908, 2006-01-04, Tom Kavanaugh, Jim Burkhard, Andy Gefen
4909, 2006-01-05, Tom Kavanaugh, Craig Smith, Stephanie Lutz
4910, 2006-01-06, Tom Kavanaugh, Eve Bjork, Joseph Willis
4911, 2006-01-09, Tom Kavanaugh, Marty Miller, Carolyn Proulx
4912, 2006-01-10, Tom Kavanaugh, Constance Swinger, Kevin Marshall
4913, 2006-01-11, Kevin Marshall, Mary Keefe, Bryan Adams
4914, 2006-01-12, Kevin Marshall, Kerri Griffith, Jesse Liu
4915, 2006-01-13, Kevin Marshall, David Grant, Michelle Hickman
4916, 2006-01-16, Kevin Marshall, Merle Capello, Chris Casper
4917, 2006-01-17, Kevin Marshall, Brian Poole, Emily Short
4918, 2006-01-18, Kevin Marshall, Amanda Pompili, John Stratford
4919, 2006-01-19, John Stratford, Rick Hoffman, Jeanne Perrier
4920, 2006-01-20, Rick Hoffman, Lisa Peabody, Marcus Jackson
4921, 2006-01-23, Marcus Jackson, Cynthia Pearson, Bob Mesko
4922, 2006-01-24, Bob Mesko, Wendy Kautz, Nick Klaiber
4923, 2006-01-25, Bob Mesko, Margaret Mitchell, Peter Booker
4924, 2006-01-26, Bob Mesko, Miranda Schwartz, Glenn Barnes
4925, 2006-01-27, Miranda Schwartz, Candy Murphy, Paul Canty
4926, 2006-01-30, Candy Murphy, William Love, Sarah Altier
4927, 2006-01-31, William Love, John Moore, Eleanor Ainslie
4928, 2006-02-01, Eleanor Ainslie, Dave Halliday, Joanna Stromberg
4929, 2006-02-02, Eleanor Ainslie, Joanna Stromberg, Tawney Pearson
4930, 2006-02-03, Eleanor Ainslie, Jennifer Kelly, Jared Poppel
4941, 2006-02-20, Jared Poppel, Pinki Mishra, Paul Callaway
4942, 2006-02-21, Paul Callaway, Marah Eakin, Dom Nguyen
4943, 2006-02-22, Marah Eakin, Samantha Kaji, Steve Toffler
4944, 2006-02-23, Samantha Kaji, Bonnie Clair, Carolyn Eichner
4945, 2006-02-24, Bonnie Clair, Trevor Pritchard, Dave Lombard
4946, 2006-02-27, Bonnie Clair, Jessica Epstein, Tim Logue
4947, 2006-02-28, Jessica Epstein, Julie Seitter, Jimmy Orsag
4948, 2006-03-01, Jimmy Orsag, Melanie Perreault, Amit Bose
4949, 2006-03-02, Amit Bose, Sharon Desser, Jack Deschauer
4950, 2006-03-03, Jack Deschauer, Deborah Melman-Clement, Kim Clemmer
4951, 2006-03-06, Deborah Melman-Clement, Bruce Brown, Matt Bregman
4952, 2006-03-07, Bruce Brown, Alicia Aho, Michael Smith
4953, 2006-03-08, Alicia Aho, Erin Glover, Randy Logan
4954, 2006-03-09, Randy Logan, Denise Hay, Mary Danieli
4955, 2006-03-10, Randy Logan, Brett Crawford, Chris Smith
4956, 2006-03-13, Chris Smith, Gerald McClanahan, Lucretia Manning
4957, 2006-03-14, Chris Smith, Erynn Masi de Casanova, John Ward
4958, 2006-03-15, John Ward, Christine Black, Nick Ruiz
4959, 2006-03-16, Christine Black, Mike Hagesfeld, Scott Gardiner
4960, 2006-03-17, Scott Gardiner, Lara Beaton, James Washick
4961, 2006-03-20, James Washick, Eric Heaton, Kate Miller
4962, 2006-03-21, Kate Miller, Patricia DiMaggio, Margaret Kickliter
4963, 2006-03-22, Patricia DiMaggio, Mary LoSardo, Dave Binnig
4964, 2006-03-23, Mary LoSardo, Jessica Liese, Ed Angleton
4965, 2006-03-24, Ed Angleton, Lars Jacobsen, Louise Hauser
4966, 2006-03-27, Ed Angleton, Trisha Murai, Nemanja Dundjerovic
4967, 2006-03-28, Nemanja Dundjerovic, Ben Goggins, Amanda Mapel
4968, 2006-03-29, Ben Goggins, Ed Lewis, Dustin Burke
4969, 2006-03-30, Ben Goggins, Barbara Watkins, Doc Hamilton
4970, 2006-03-31, Doc Hamilton, Chrissy Hoffman, Craig Mobley
4971, 2006-04-03, Craig Mobley, Wendy Brown, Rena Miller
4972, 2006-04-04, Craig Mobley, Michael Falk, Lizard Hogge
4973, 2006-04-05, Michael Falk, Suzan Reiner, Rory Cowan
4974, 2006-04-06, Michael Falk, Stacy McKnight, Peggy Till
4975, 2006-04-07, Michael Falk, William Lee, Melanie Madden
4976, 2006-04-10, William Lee, Van Tarpley, John Dickas
4977, 2006-04-11, William Lee, Kathy Lisiewicz, Dan Lee
4978, 2006-04-12, Kathy Lisiewicz, Melissa Ahart, Tom Ricketts
4979, 2006-04-13, Melissa Ahart, Brian Lamb, Raena de Silvia
4980, 2006-04-14, Brian Lamb, Nissan Cohen, Liana Garcia
4981, 2006-04-17, Brian Lamb, Bob Mesko, Holly Owens
4982, 2006-04-18, Bob Mesko, Luis Sandoval, Melissa Garber
4983, 2006-04-19, Bob Mesko, Kathleen Larkey, Rodney Waites
4984, 2006-04-20, Kathleen Larkey, Doug Dorst, Erika Engstrom
4985, 2006-04-21, Doug Dorst, Sally Vaughn, Jimmie Bise Jr.
4986, 2006-04-24, Doug Dorst, Greg Little, Jacqueline Lovell
4987, 2006-04-25, Doug Dorst, Theo Caldwell, Gigi Gilman
4988, 2006-04-26, Gigi Gilman, Margaret Holz, Michael Lapthorn
4989, 2006-04-27, Michael Lapthorn, Jaime Thomson, Don Minyard
4990, 2006-04-28, Don Minyard, Fred Schultz, Lisa Izes
4991, 2006-05-01, Fred Schultz, Nathan Thornton, Barbara Tarlau
4992, 2006-05-02, Fred Schultz, Laura Brown, Matt Garbett
4993, 2006-05-03, Laura Brown, Luke Walker, Robbi Rogers
4994, 2006-05-04, Robbi Rogers, Bob Collins, Stephanie Smith
4995, 2006-05-05, Bob Collins, Dan McLeod, Karmie Johnson
5006, 2006-05-22, Dan McLeod, Harvey Cormier, John Rivers
5007, 2006-05-23, Harvey Cormier, Devin Landin, Tricia Barreiro
5008, 2006-05-24, Tricia Barreiro, Matt Sojot, Karla Sortland
5009, 2006-05-25, Tricia Barreiro, Robb Muhm, Julie Backer
5010, 2006-05-26, Robb Muhm, Keith Suta, Stella Daily
5011, 2006-05-29, Keith Suta, Amy Cash, Eric Dolansky
5012, 2006-05-30, Eric Dolansky, Kristen Meinhold, Ken Hinton
5013, 2006-05-31, Eric Dolansky, Steve Friedman, Nathan Meyers
5014, 2006-06-01, Nathan Meyers, Kathy Daum, Jonathan Spencer
5015, 2006-06-02, Jonathan Spencer, Dan Sander, Richard Vehlow
5016, 2006-06-05, Dan Sander, Audrey Ng, Bill Duncliffe
5017, 2006-06-06, Dan Sander, Stefanie Morales, Marcia Jensen
5018, 2006-06-07, Dan Sander, Roberta Ellington, Quinn Saunders
5019, 2006-06-08, Roberta Ellington, Jessica Tanner, Kerry Rucidlo
5020, 2006-06-09, Roberta Ellington, Thomas Talbot, Craig Westphal
5021, 2006-06-12, Craig Westphal, Matt Wauben, Bill Weylock
5022, 2006-06-13, Craig Westphal, Lisa Kushida, Don Tenney
5023, 2006-06-14, Craig Westphal, Danielle Kolker, Bob Puett
5024, 2006-06-15, Craig Westphal, Doug O'Brien, Maggie Parcells
5025, 2006-06-16, Craig Westphal, Gerald Bergen, Josh Kennedy
5026, 2006-06-19, Josh Kennedy, Leigh Hall, David Ono
5027, 2006-06-20, Josh Kennedy, Sioux Stoeckle, Clark Floyd
5028, 2006-06-21, Clark Floyd, Amanda Ross-White, Tony Mahler
5029, 2006-06-22, Clark Floyd, Kathy Damstra, Theresa Larson
5030, 2006-06-23, Theresa Larson, Chris Knight, John Perez
5031, 2006-06-26, Chris Knight, Joan Belen, Mark Edelson
5032, 2006-06-27, Mark Edelson, Ryan McMillen, Priya Bhatia Yerasi
5033, 2006-06-28, Mark Edelson, Cait Murphy, Sidney Tison
5034, 2006-06-29, Sidney Tison, John Hooper, Jennifer Casey
5035, 2006-06-30, Jennifer Casey, Jeff Knorr, Susannah Jacobson
5036, 2006-07-03, Susannah Jacobson, Mike Pesca, Judy Rudnick
5037, 2006-07-04, Susannah Jacobson, Michelle Bondurant, A.K. Subramanian
5038, 2006-07-05, Michelle Bondurant, Seth Supcoff, Vanessa Meikle
5039, 2006-07-06, Seth Supcoff, Rich Small, Jo Davidson
5040, 2006-07-07, Rich Small, Brett McGlasson, Erin Weiss
5041, 2006-07-10, Rich Small, Hanna Miller, David Nikithser
5042, 2006-07-11, David Nikithser, Dena Martin, Louis Rice
5043, 2006-07-12, David Nikithser, Susan Matejko, Tom Waskom
5044, 2006-07-13, Susan Matejko, Eric Allen, Rebecca Pinchoff
5045, 2006-07-14, Eric Allen, Lisa Llanes-Simpson, Bruce Lin
5046, 2006-07-17, Bruce Lin, Jennifer Laam, Scott Ahearn
5047, 2006-07-18, Bruce Lin, Ann Rupel, Justin Budinoff
5048, 2006-07-19, Bruce Lin, Inie Park, Matt Mullins
5049, 2006-07-20, Inie Park, Jim Mainguy, Celeste DiNucci
5050, 2006-07-21, Celeste DiNucci, Alex Hunnicutt, Steve Bingo
5051, 2006-07-24, Celeste DiNucci, Erika Austin, Margaret J. McCarthy
5052, 2006-07-25, Celeste DiNucci, Brent Tabacchi, Debra Mack
5053, 2006-07-26, Celeste DiNucci, Matthew Mitchell, Theresa Kenny
5054, 2006-07-27, Celeste DiNucci, Eugene Manning, Danelle Johnson
5055, 2006-07-28, Eugene Manning, Reda Chambers, Brad Jeffcoat
5056, 2006-09-11, Brad Jeffcoat, Lauren Hirs, Dan Cordova
5057, 2006-09-12, Lauren Hirs, Timothy Benston, Nathalie Henderson
5058, 2006-09-13, Nathalie Henderson, Meighan Larbi, Matt Thomas
5059, 2006-09-14, Meighan Larbi, Robert Gomma, Mary Plews
5060, 2006-09-15, Meighan Larbi, Jennifer Czechowski, Lou Bayard
5061, 2006-09-18, Lou Bayard, Sara Terrell, Sean Carson
5062, 2006-09-19, Sara Terrell, Jack Martin, Allison Otto
5063, 2006-09-20, Sara Terrell, Alexandra Petri, Nick Calton
5064, 2006-09-21, Sara Terrell, Nick Calton, Cathleen Charleson
5065, 2006-09-22, Sara Terrell, Donna Deans, Charlton Wilbur
5066, 2006-09-25, Donna Deans, Janet Marnane, Eric Barela
5067, 2006-09-26, Eric Barela, Brett Hart, Brenda Buchanan
5068, 2006-09-27, Eric Barela, Lauren High, Ken Davis
5069, 2006-09-28, Eric Barela, Ray Sun, Suzette Mariotti
5070, 2006-09-29, Ray Sun, Lynn Schuetter, Jason Scull
5076, 2006-10-09, Lynn Schuetter, Sherman Lo, Nicole Cook
5077, 2006-10-10, Sherman Lo, Kathleen Fuller, David Dietz
5078, 2006-10-11, Sherman Lo, Steve Jenkins, Maria Capucciati
5079, 2006-10-12, Steve Jenkins, Oz Vazquez, Ruth Dammel
5080, 2006-10-13, Ruth Dammel, Jim McMurtry, Liddy Gerchman Barlow
5081, 2006-10-16, Jim McMurtry, Bret Rosson, Sharon Wing
5082, 2006-10-17, Jim McMurtry, Joe Leibrandt, Danny Loss
5083, 2006-10-18, Joe Leibrandt, Larry Clow, Brooke Wilberg
5084, 2006-10-19, Joe Leibrandt, Andy Reese, Elesha Coffman
5085, 2006-10-20, Joe Leibrandt, Linda Sue Park, Dave Singleton
5086, 2006-10-23, Dave Singleton, John Bowen, Rick Walsh
5087, 2006-10-24, John Bowen, Andrew Espinoza, Rachael Dietrich
5088, 2006-10-25, Andrew Espinoza, Tracy Parrish Wolfe, Benjamin Tomkins
5089, 2006-10-26, Tracy Parrish Wolfe, Jason Stuart, Chris Mazurek
5090, 2006-10-27, Chris Mazurek, Gillian Chan, Joan Nelson
5091, 2006-10-30, Chris Mazurek, Monica Sousa, Susan Turi
5092, 2006-10-31, Chris Mazurek, Connie Toohey, Michael Green
5093, 2006-11-01, Chris Mazurek, Liz Channon, Jim Spilman
5094, 2006-11-02, Jim Spilman, Caroline Waddell Zarzar, Dave Meddish
5095, 2006-11-03, Dave Meddish, Cobra Becerra, Jane Toczek
5096, 2006-11-06, Dave Meddish, Shane McCune, Jeff Spoeri
5097, 2006-11-07, Jeff Spoeri, Julie Kovach, Ozgun Tumer
5108, 2006-11-22, Jeff Spoeri, Maureen McCuen, Brad Waller
5109, 2006-11-23, Jeff Spoeri, Carl Swanson, Sarah Ramer
5110, 2006-11-24, Jeff Spoeri, Jacob Cytryn, Teresa Cahalan
5111, 2006-11-27, Jeff Spoeri, Ryan Friedman, Mary Voigt
5112, 2006-11-28, Ryan Friedman, Suzanne Ennis, Ehren Schwiebert
5113, 2006-11-29, Ryan Friedman, David Maynard, Alexia Henke
5114, 2006-11-30, Ryan Friedman, Ruth Comer, Lynne Sherwin
5115, 2006-12-01, Lynne Sherwin, Terry Pflaumer, Sean Dillon
5116, 2006-12-04, Sean Dillon, Sue Bryant, Bob Hutton
5117, 2006-12-05, Bob Hutton, Linda Flink, Evelyn Uyemura
5118, 2006-12-06, Linda Flink, Christian Haines, Sean Gilsdorf
5119, 2006-12-07, Christian Haines, Dan McMurray, Kate Harvey
5120, 2006-12-08, Christian Haines, Gilbert Mercado, Rebecca Bizonet
5121, 2006-12-11, Christian Haines, John Gershkoff, Robin Pelkey
5122, 2006-12-12, Christian Haines, Lorraine Mariz, Perry Gentry
5123, 2006-12-13, Lorraine Mariz, Tara Kolden, Cory Hartman
5124, 2006-12-14, Cory Hartman, Ann Fletcher, R.J. Lesch
5125, 2006-12-15, R.J. Lesch, Paula Frome, Rob Donnelly
5126, 2006-12-18, Paula Frome, Steve Unite, Jody Callahan
5127, 2006-12-19, Steve Unite, Christian Ruud, Mariann Buonadonna
5128, 2006-12-20, Steve Unite, Jen Anders, Sherri Schottlaender
5129, 2006-12-21, Steve Unite, Max Joel, Jane Glass
5130, 2006-12-22, Steve Unite, Sarah Callanan, Jeannette Harrison
5131, 2006-12-25, Steve Unite, Glenn Woertz, David Mayer
5132, 2006-12-26, Glenn Woertz, Robert Alden, Jocelyn Beer
5133, 2006-12-27, Robert Alden, Jeff Rozen, Lisa McClain
5134, 2006-12-28, Lisa McClain, Carol Pal, Jared Thompson
5135, 2006-12-29, Jared Thompson, Laura Piantes, Frank Liu
5136, 2007-01-01, Jared Thompson, Jeff Schwartz, Peg Pruitt
5137, 2007-01-02, Peg Pruitt, Julie Dunlevy, Dave Mills
5138, 2007-01-03, Julie Dunlevy, Luann Reed-Siegel, Dan Schulte
5139, 2007-01-04, Julie Dunlevy, Michelle Dunstan, Chris Havener
5140, 2007-01-05, Julie Dunlevy, Jean Maguire, Jeremy Rasmussen
5141, 2007-01-08, Jeremy Rasmussen, Chris Renz, Willie Chriesman
5142, 2007-01-09, Chris Renz, Michael Driscoll, Nathan Crane
5143, 2007-01-10, Nathan Crane, Susan Ferrari, Alan Husby
5144, 2007-01-11, Alan Husby, Kelly Isenor, Cindy Peters
5145, 2007-01-12, Kelly Isenor, Val Adamcyk, Dom Ochotorena
5146, 2007-01-15, Kelly Isenor, Brian Armbrust, JC Honeycutt
5147, 2007-01-16, Brian Armbrust, Paula Ashley, Greg Williams
5148, 2007-01-17, Greg Williams, Jim Eddy, Al Cadena
5149, 2007-01-18, Al Cadena, Katy Tripodi Griffith, Linda Schildkraut
5150, 2007-01-19, Linda Schildkraut, Jason Aucker, Jeremy Walker
5151, 2007-01-22, Linda Schildkraut, Dawn Alsvary, Leah Buswell
5152, 2007-01-23, Leah Buswell, Freddy Bee, Jen Heddle
5153, 2007-01-24, Freddy Bee, Su Kim, Emily Seftel
5154, 2007-01-25, Su Kim, Allisson Seiler, Kazim Ali
5155, 2007-01-26, Su Kim, Nate Meyer, Stephen Cooper
5156, 2007-01-29, Su Kim, Robin Parry, Ben Kroll
5157, 2007-01-30, Robin Parry, Jon Protas, Cindi Winstead
5158, 2007-01-31, Cindi Winstead, Nate Metcalf, Katie McArthur
5159, 2007-02-01, Nate Metcalf, Derek Robinson, Wayne Cherry
5160, 2007-02-02, Wayne Cherry, Tana Sibilio, Erica Eaton
5171, 2007-02-19, Wayne Cherry, Rob Faunce, Amanda Froning
5172, 2007-02-20, Amanda Froning, Sarah Bruce, Brad Haag
5173, 2007-02-21, Brad Haag, Sue Saunders, Ted Dudley
5174, 2007-02-22, Ted Dudley, Ursula Ellis, Sri Narayanan
5175, 2007-02-23, Sri Narayanan, Dorothy Cassetta, Jim Sherman
5176, 2007-02-26, Sri Narayanan, Chuck Newell, Marc Spraragen
5177, 2007-02-27, Marc Spraragen, Jim Waldo, Claire Ward
5178, 2007-02-28, Marc Spraragen, Robert Ashley, Rosanna Cavallaro
5179, 2007-03-01, Robert Ashley, Brian Morris, Jennifer Nield Cameron
5180, 2007-03-02, Brian Morris, Margaret Tennison, Doug Tibbs
5181, 2007-03-05, Margaret Tennison, David Wlody, Eileen Loechel
5182, 2007-03-06, Eileen Loechel, Courtney Smotherman, Martin Budak
5183, 2007-03-07, Martin Budak, Harry Stessel, Sunny Wyers
5184, 2007-03-08, Martin Budak, Carla Eastis, Ted Kenniston
5185, 2007-03-09, Ted Kenniston, Albert Chi, Rachel Campbell
5186, 2007-03-12, Ted Kenniston, Will Porter, Jennifer Gotcher
5187, 2007-03-13, Jennifer Gotcher, Pat Cantor, Tom Gort
5188, 2007-03-14, Jennifer Gotcher, Sheryl Page, Scott Weiss
5189, 2007-03-15, Scott Weiss, Bobbie Hartman, Michael Bandiera
5190, 2007-03-16, Scott Weiss, Jamey Kirby, Anders Martinson
5191, 2007-03-19, Scott Weiss, Jamey Kirby, Anders Martinson
5192, 2007-03-20, Jamey Kirby, Steve Snyder, Debbie Harris
5193, 2007-03-21, Jamey Kirby, Paul Horwitz, Ruth Merriam
5194, 2007-03-22, Paul Horwitz, Connie Walters, Alison Fowler
5195, 2007-03-23, Alison Fowler, Doug Hicton, Leigh King
5196, 2007-03-26, Doug Hicton, Tony Fernandez-Vinas, Ashley Tongret
5197, 2007-03-27, Doug Hicton, Khoa Le, Betsy Bangs
5198, 2007-03-28, Doug Hicton, Brendan Pimper, Samantha Ross
5199, 2007-03-29, Samantha Ross, Arlynda Boyer, Steven Price
5200, 2007-03-30, Steven Price, Ross Brown, Bill Gabbard
5201, 2007-04-02, Ross Brown, Lenzy Krehbiel-Burton, Craig Nemiroff
5202, 2007-04-03, Lenzy Krehbiel-Burton, Brian Robin, Catherine Allen
5203, 2007-04-04, Brian Robin, Rita Schwab-Parcel, Chris Possinger
5204, 2007-04-05, Rita Schwab-Parcel, Ron Grant, Kelly Knight
5205, 2007-04-06, Ron Grant, William Thill, Susan Herder
5206, 2007-04-09, Susan Herder, Diana Wheatley, Fred Bauer
5207, 2007-04-10, Susan Herder, Kate Zimmermann, David Haglund
5208, 2007-04-11, Kate Zimmermann, Karen Anderson, Tim Woodward
5209, 2007-04-12, Karen Anderson, Jen Benedict, Chris Dellicarpini
5210, 2007-04-13, Chris Dellicarpini, Matt Sojot, Gin Peck
5211, 2007-04-16, Gin Peck, Ryan Hall, Tricia McKinney
5212, 2007-04-17, Tricia McKinney, Michael Cholbi, Carol Tilley
5213, 2007-04-18, Tricia McKinney, Daniel Pollack-Pelzner, Ann Cole
5214, 2007-04-19, Tricia McKinney, William Lee, Andrea Ozment
5215, 2007-04-20, William Lee, Laura Wimberley, Sandy Yates
5216, 2007-04-23, Laura Wimberley, Mary Beth Kinnon, Victor Lee
5217, 2007-04-24, Laura Wimberley, Michael O'Hara, Maggi McKenzie
5218, 2007-04-25, Laura Wimberley, Misha Dashevsky, Zelda Nash
5219, 2007-04-26, Zelda Nash, Andrew Rostan, Pam Spitzner
5220, 2007-04-27, Andrew Rostan, Brian Marshall, Juli Hinds
5231, 2007-05-14, Andrew Rostan, Justin Cober-Lake, Sue Heitzman
5232, 2007-05-15, Andrew Rostan, Carol Gerber, Bill Wilson
5233, 2007-05-16, Andrew Rostan, Lenore Garon, Jamil Muhammad
5234, 2007-05-17, Andrew Rostan, Tigger Jourard, Sara Westrick Schomig
5235, 2007-05-18, Sara Westrick Schomig, John Lisiewicz, Martin Hughes
5236, 2007-05-21, Martin Hughes, Allison Frisbee, Vic Sawyer
5237, 2007-05-22, Vic Sawyer, Cindy Ladensack, James Clark
5238, 2007-05-23, James Clark, Susan Wessells, Joe Pozzuoli
5239, 2007-05-24, James Clark, Mehrun Etebari, Pauline Harris
5240, 2007-05-25, Mehrun Etebari, Keith VanDen Heuvel, Lisa Cope
5241, 2007-05-28, Mehrun Etebari, David Turley, Grace Tighe
5242, 2007-05-29, Mehrun Etebari, Katy Hardy, Carlos Alcala
5243, 2007-05-30, Mehrun Etebari, Phil Cunneff, Dianne Lindsay
5244, 2007-05-31, Mehrun Etebari, Renee Paradis, Mike Donner
5245, 2007-06-01, Mike Donner, Bobbie Cassell, Lilly Ridge
5246, 2007-06-04, Mike Donner, Leigh Bachman, John Walsh
5247, 2007-06-05, John Walsh, Heidi Sanchez, Ssezi Mukasa
5248, 2007-06-06, Heidi Sanchez, Toho Soma, Sarah Martin
5249, 2007-06-07, Heidi Sanchez, Susan Mitchell, Marilyn Carnahan
5250, 2007-06-08, Susan Mitchell, Marta Bowman, Michael Condouris
5251, 2007-06-11, Susan Mitchell, Karla Sortland, Matt Locke
5252, 2007-06-12, Susan Mitchell, Karen Meyers, Mitch Luxenberg
5253, 2007-06-13, Susan Mitchell, Amber Hodges, Jared Cohen
5254, 2007-06-14, Jared Cohen, Heather Williams, Ronni Stolzenberg
5255, 2007-06-15, Jared Cohen, Alex Hovan, Angel Gomez
5256, 2007-06-18, Alex Hovan, Kai-Ning Jan, Shane Glynn
5257, 2007-06-19, Kai-Ning Jan, Susan Otto, Jesse Berry
5258, 2007-06-20, Jesse Berry, Dave Dye, Bonnie Humphrey
5259, 2007-06-21, Jesse Berry, Don Stewart, Mary Ann Hilterhaus
5260, 2007-06-22, Jesse Berry, Matt Corcoran, Deana Weibel-Swanson
5261, 2007-06-25, Matt Corcoran, Tony Suffoletta, Katy Clarke
5262, 2007-06-26, Matt Corcoran, Brian Lamb, Cathy Lanctot
5263, 2007-06-27, Cathy Lanctot, Judson Knight, Joe Sosnoff
5264, 2007-06-28, Cathy Lanctot, Amy Ryan, Rosemary Travis
5265, 2007-06-29, Cathy Lanctot, Colleen Shaddox, Roy Arias
5266, 2007-07-02, Cathy Lanctot, Wilson Rickerson, Jessica Eyde
5267, 2007-07-03, Cathy Lanctot, Keith Kashiwada, Holly Owens
5268, 2007-07-04, Holly Owens, Rachael King, Edgar B. Herwick III
5269, 2007-07-05, Holly Owens, Judy Moss, Tim Abou-Sayed
5270, 2007-07-06, Tim Abou-Sayed, Jennifer Gossett, Sandi Lin
5271, 2007-07-09, Tim Abou-Sayed, Helen Freeman, Josh Kamensky
5272, 2007-07-10, Tim Abou-Sayed, Tom Traylor, Monica Lenhard
5273, 2007-07-11, Monica Lenhard, Zach Baker, Sheila Runyon
5274, 2007-07-12, Zach Baker, Robyn Shepherd, Nancy Kimmel
5275, 2007-07-13, Zach Baker, Amy Fuller, Ben Taylor
5286, 2007-09-10, Ben Taylor, Keli Jackson, Dorothy Gilmartin
5287, 2007-09-11, Keli Jackson, Rick Kent, Megan Bygness
5288, 2007-09-12, Rick Kent, Lucy Prentiss, Wilson York
5289, 2007-09-13, Rick Kent, Dave Henek, Kim Murphy
5290, 2007-09-14, Rick Kent, Clé Holly, Matt Caporaletti
5291, 2007-09-17, Matt Caporaletti, Joanne Platt, Jennifer Gaspar Schreiner
5292, 2007-09-18, Joanne Platt, JT Nuckolls, Shweta Kumar
5293, 2007-09-19, Joanne Platt, Adam Blau, Ann Gavaghan
5294, 2007-09-20, Ann Gavaghan, Donal Coomey, Erica Endicott
5295, 2007-09-21, Donal Coomey, Sara Price, Linda Lipkin
5296, 2007-09-24, Sara Price, Elizabeth McKenna, Albert Chu
5297, 2007-09-25, Elizabeth McKenna, Kirk Jordan, Susan Christman
5298, 2007-09-26, Kirk Jordan, Kevin Martin, Megan Lynch
5299, 2007-09-27, Kevin Martin, Lateefah Torrence, Richard Johnson
5300, 2007-09-28, Richard Johnson, Sharon Lin, Joseph Thompson
5301, 2007-10-01, Sharon Lin, Brett Chandler, Kim Zarkin
5302, 2007-10-02, Brett Chandler, Jen Maloney, Todd Butler
5303, 2007-10-03, Todd Butler, Britt Terry, Rita Byrd
5304, 2007-10-04, Todd Butler, Paul Barndt, Matt Pensinger
5305, 2007-10-05, Matt Pensinger, Sara Clarke, David Daniel
5311, 2007-10-15, David Daniel, Pamela Chin, Trip Robertson
5312, 2007-10-16, David Daniel, Chris Jason, Susan Kelleher
5313, 2007-10-17, Chris Jason, Linda Zell Randall, Shad Small
5314, 2007-10-18, Linda Zell Randall, Shad Small, Michael Boisson
5315, 2007-10-19, Shad Small, Clare Willis, Barbara Frascelli
5316, 2007-10-22, Shad Small, Lee Ann Farmer, Nick Swezey
5317, 2007-10-23, Nick Swezey, Tim Lesle, Aaron Shapiro
5318, 2007-10-24, Nick Swezey, Tope Charlton, Kelly Sherer
5319, 2007-10-25, Nick Swezey, Tracy Martinell Henry, Kevin Antonio
5320, 2007-10-26, Tracy Martinell Henry, Paul Glaser, Cathy Thomas
5321, 2007-10-29, Paul Glaser, Kathleen Lohmann, Pat Kennedy
5322, 2007-10-30, Paul Glaser, Linda Ulery, Kevin Hullihan
