7392, 2016-11-01, Thea Lawton, Vivek Ravishanker, Denver Wade
7393, 2016-11-02, Vivek Ravishanker, Courtney Cissel, Dennis Fipps
7394, 2016-11-03, Vivek Ravishanker, Rachel Hopkins, Sharon Stern Gerstman
7395, 2016-11-04, Rachel Hopkins, Donna Goldberg, Chuck Dunn
7396, 2016-11-07, Chuck Dunn, Georjean McKeeman, Kat Lewin
7397, 2016-11-08, Georjean McKeeman, Stephanie Hubley, Allon Scheyer
7408, 2016-11-23, Stephanie Hubley, Christina Boyadjian, Andrew Lee
7409, 2016-11-24, Andrew Lee, Jay Johnson, Lexie Gagliardi
7410, 2016-11-25, Andrew Lee, Liz Hutchens, Justin Bender
7411, 2016-11-28, Justin Bender, Hobie Barnes, Allison Totura
7412, 2016-11-29, Justin Bender, Dan Chafetz, Jennifer Berry
7413, 2016-11-30, Justin Bender, Michael Malyszko, Vicki Kelly
7414, 2016-12-01, Justin Bender, Kylie Carrithers, Asim Modi
7415, 2016-12-02, Asim Modi, Ryan O'Shea, Tim Aten
7416, 2016-12-05, Tim Aten, Yi Deng, Matthew Martinez
7417, 2016-12-06, Tim Aten, Alison Carey, Anuj Patel
7418, 2016-12-07, Tim Aten, Jaime Ryan, Wendi Rottweiler
7419, 2016-12-08, Tim Aten, Stephanie Snyder, Anton Deljaj
7420, 2016-12-09, Tim Aten, Jim Yulman, Lara Croft
7421, 2016-12-12, Tim Aten, Amy Young, Bridget McNulty
7422, 2016-12-13, Tim Aten, Garrett Levenbrook, Cindy Stowell
7423, 2016-12-14, Cindy Stowell, Susanna Barron, Edward Montiel
7424, 2016-12-15, Cindy Stowell, Chelsea Cohen, Sara Quashnie
7425, 2016-12-16, Cindy Stowell, Erin Williams, Michael Rollins
7426, 2016-12-19, Cindy Stowell, Jonathan Bill, Kristin Szuhany
7427, 2016-12-20, Cindy Stowell, Julia Kite, Colleen Cooper
7428, 2016-12-21, Cindy Stowell, Sam Scovill, Jennifer Johnson
7429, 2016-12-22, Sam Scovill, Amelia Reinwald, Brad Snyder
7430, 2016-12-23, Sam Scovill, Molly Thacker, Vinnie Chiappini
7431, 2016-12-26, Sam Scovill, Wren Allen, Stephanie Schlatter
7432, 2016-12-27, Stephanie Schlatter, Colin Utley, Hallie Boston
7433, 2016-12-28, Stephanie Schlatter, Mike Lamar, Justin Scace
7434, 2016-12-29, Justin Scace, Mukund Marathe, Nathalie Szilagyi
7435, 2016-12-30, Mukund Marathe, Kate Gran, Ryan VanderYacht
7436, 2017-01-02, Mukund Marathe, Gavin Mulligan, Katie Carter
7437, 2017-01-03, Gavin Mulligan, Rebecca Glass, Amanda Berofsky
7438, 2017-01-04, Amanda Berofsky, Rich Betz, Megan Soto
7439, 2017-01-05, Amanda Berofsky, Joe Bartolomeo, Kelsey Morgan
7440, 2017-01-06, Joe Bartolomeo, Dante Atkins, Christina Bussmann
7441, 2017-01-09, Joe Bartolomeo, Blair Moorhead, Jack Paleczny
7442, 2017-01-10, Blair Moorhead, Colby Taylor, Libby Hunt
7443, 2017-01-11, Colby Taylor, Zoey Orol, Alain Norman
7444, 2017-01-12, Zoey Orol, Sarah Labadie, Cheryl Guy
7445, 2017-01-13, Cheryl Guy, Eli Nehus, Tanner Hesse
7446, 2017-01-16, Eli Nehus, John Avila, Mary Caruso
7447, 2017-01-17, John Avila, Andrea Keppers, Pete Tachibana
7448, 2017-01-18, John Avila, Aaron Ellis, Sherri Cohen
7449, 2017-01-19, John Avila, Rachel Bauman, Neil Uspal
7450, 2017-01-20, Neil Uspal, Cathy Harding, Hardy Clervil
7451, 2017-01-23, Neil Uspal, Sean Harrington, Vidya Srinivasan
7452, 2017-01-24, Sean Harrington, Derek Anderson, Loren Lee Chen
7453, 2017-01-25, Loren Lee Chen, Stephanie Cornelison, Hugh Dinteman
7454, 2017-01-26, Loren Lee Chen, Christy Karras, Josiah Drewien
7455, 2017-01-27, Christy Karras, Lisa Schlitt, Paul Cox
7456, 2017-01-30, Lisa Schlitt, Joe Di Dio, Valerie Connors
7457, 2017-01-31, Lisa Schlitt, Ben Smolen, Doug Baker
7458, 2017-02-01, Lisa Schlitt, Julie Bradlow, Amanda Harvey
7459, 2017-02-02, Lisa Schlitt, Warren Toland, Sean Dennison
7460, 2017-02-03, Lisa Schlitt, Tyler Johnson, Marion Montgomery
7461, 2017-02-06, Lisa Schlitt, Jill Rausch, Matt Kellison
7462, 2017-02-07, Jill Rausch, Jody Jabbora, Lauren Michniacki
7463, 2017-02-08, Jody Jabbora, Carl Falstrom, Kirstin Cutts
7464, 2017-02-09, Kirstin Cutts, Megan Hersman, Kate Reed Hauenstein
7465, 2017-02-10, Kirstin Cutts, Sara Callori, Brandon Beckler
7476, 2017-02-27, Kirstin Cutts, Sam Oglesby, Amy Sumner
7477, 2017-02-28, Kirstin Cutts, Rob Liguori, Leanne Vincent
7478, 2017-03-01, Rob Liguori, Kate Edwards, Joe Friedman
7479, 2017-03-02, Rob Liguori, Nil Jones, Crista Calderon
7480, 2017-03-03, Rob Liguori, Trish Floyd, Jeff Brown
7481, 2017-03-06, Rob Liguori, Alison Maguire-Powell, Ernie Sykes
7482, 2017-03-07, Alison Maguire-Powell, Shawn Friend, Todd DeFilippi
7483, 2017-03-08, Todd DeFilippi, John Paul Gove, Annie Marggraf
7484, 2017-03-09, Annie Marggraf, Rachel Moyer, Serena Kay Tibbitt
7485, 2017-03-10, Annie Marggraf, Adam Lapetina, Jessica Johnston
7486, 2017-03-13, Jessica Johnston, Bonnie Harris, Michael Roy
7487, 2017-03-14, Jessica Johnston, Lolita Welch, Grant McSheffrey
7488, 2017-03-15, Grant McSheffrey, Elisabeth Lancaster, Brendon Stanton
7489, 2017-03-16, Grant McSheffrey, Gretchen Neidhardt, Steve Pecukonis
7490, 2017-03-17, Grant McSheffrey, Rebecca Wald, Holly Stewart
7491, 2017-03-20, Rebecca Wald, Eli Rosenberger, Christiane Evaskis-Garrett
7492, 2017-03-21, Rebecca Wald, Adam Weissengruber, Kevin Shrum
7493, 2017-03-22, Kevin Shrum, Madeline Wilson, Emlen Smith
7494, 2017-03-23, Kevin Shrum, Robin Devereux, Stephanie Garrone-Shufran
7495, 2017-03-24, Stephanie Garrone-Shufran, Jon Beebe, Robert Weibezahl
7496, 2017-03-27, Robert Weibezahl, Adam Vesterholt, Meral Cultu
7497, 2017-03-28, Adam Vesterholt, Julie Brannon, Steve Asiatico
7498, 2017-03-29, Julie Brannon, Rachel Levinson-Emley, Tricia Riley
7499, 2017-03-30, Julie Brannon, Brook North, Eric Vernon
7500, 2017-03-31, Eric Vernon, Andrea Palmiter, Aaron Benor
7501, 2017-04-03, Eric Vernon, Abigail Myers, Billy Wong
7502, 2017-04-04, Abigail Myers, Jace Cochran, Lena Liberman
7503, 2017-04-05, Abigail Myers, Amy Falconetti, Nora Rowaily
7504, 2017-04-06, Nora Rowaily, David Gatewood, Maresha Mead
7505, 2017-04-07, David Gatewood, Brad Shumel, Pat Greiner
7506, 2017-04-10, Pat Greiner, Greg Chin, Maren Beazer
7507, 2017-04-11, Greg Chin, Steve Gavenas, Atissa Banuazizi
7508, 2017-04-12, Greg Chin, Trevor Mahoney, Jane Joseph
7509, 2017-04-13, Jane Joseph, Lee Barrow, Deborah Beams
7510, 2017-04-14, Deborah Beams, Elspeth Green, Jim Hope
7511, 2017-04-17, Deborah Beams, Jamie Newland, Kevin McGinty
7512, 2017-04-18, Jamie Newland, Kimberly Bond, Ani Gupta
7513, 2017-04-19, Jamie Newland, Emmett Robinson, Diana Ascher
7514, 2017-04-20, Emmett Robinson, Nilanka Seneviratne, Joanne Huether
7515, 2017-04-21, Nilanka Seneviratne, David Rigsby, Meghan Phillips
7516, 2017-04-24, David Rigsby, Emma Florio, Alan Lin
7517, 2017-04-25, Alan Lin, Dan Atherton, Meike Olin
7518, 2017-04-26, Alan Lin, Chelan Allen, Samm Chiszar
7519, 2017-04-27, Alan Lin, Jennifer Fuquay, Troy Steinmetz
7520, 2017-04-28, Alan Lin, Rachel Snyder, Kevin McCarthy
7521, 2017-05-01, Alan Lin, Matt Cohen, Meghan Treptow
7522, 2017-05-02, Alan Lin, Chris Burke, Liz Fischer
7523, 2017-05-03, Liz Fischer, Krista Denn, Ragavan Ramsubramani
7524, 2017-05-04, Ragavan Ramsubramani, Erin Wilson, Laura Spoelstra
7525, 2017-05-05, Ragavan Ramsubramani, Rich Steeves, Seth Madej
7536, 2017-05-22, Ragavan Ramsubramani, Justin Braddock, Tanya Obreiter
7537, 2017-05-23, Tanya Obreiter, Daniel Okamura, Kelly Sullivan
7538, 2017-05-24, Tanya Obreiter, Mackenzie Vogt, Matthew Cooper
7539, 2017-05-25, Mackenzie Vogt, Melanie Tannenbaum Hepler, Jon Groubert
7540, 2017-05-26, Jon Groubert, Sam Spencer, Liz Bass
7541, 2017-05-29, Jon Groubert, Emily Hollins, Megan Clair
7542, 2017-05-30, Jon Groubert, Kerry Benn, Rand Wise
7543, 2017-05-31, Kerry Benn, Lisette Pringle, Joe Nguyen
7544, 2017-06-01, Joe Nguyen, Christie Burke, Coby Klein
7545, 2017-06-02, Joe Nguyen, Miles Lake, Erin Mewes
7546, 2017-06-05, Joe Nguyen, Buzz Newberry, Chantelle Schofield
7547, 2017-06-06, Chantelle Schofield, Mike Ponterotto, Tracy Bacon
7548, 2017-06-07, Chantelle Schofield, Bala Kumar, Phyllis Gilbert
7549, 2017-06-08, Bala Kumar, Scott Bergeron, Sarah Waldsmith
7550, 2017-06-09, Bala Kumar, Tucker Dunn, Johanna Andrews
7551, 2017-06-12, Tucker Dunn, Liz Kuster, Janna Seals
7552, 2017-06-13, Tucker Dunn, Stan Jastrzebski, Dylan Watton
7553, 2017-06-14, Tucker Dunn, Becca Arm, Phil Ricciardi
7554, 2017-06-15, Phil Ricciardi, Jacob Jenkelowitz, Debb Johnson
7555, 2017-06-16, Debb Johnson, Melanie Glassco, Peter Guekguezian
7556, 2017-06-19, Peter Guekguezian, Jeremy Fassler, Barbara Fox
7557, 2017-06-20, Peter Guekguezian, Melissa Dean, Chris Nadon
7558, 2017-06-21, Peter Guekguezian, Matt Sokol, Lisa Evans
7559, 2017-06-22, Lisa Evans, Natasha Baker-Bradley, Daniel Esch
7560, 2017-06-23, Lisa Evans, Pat McNamee, Brittany Franckowiak
7561, 2017-06-26, Pat McNamee, Elisabeth Larsen, Brandon Randall
7562, 2017-06-27, Brandon Randall, Heather Hurley, Shannon Crock
7563, 2017-06-28, Brandon Randall, Nathan Flynn, William Baldwin
7564, 2017-06-29, Nathan Flynn, Clint Thompson, Megan Williams
7565, 2017-06-30, Clint Thompson, Jon Eisenman, Allan Ashley
7566, 2017-07-03, Jon Eisenman, Trevor Schultz, Emily Campbell
7567, 2017-07-04, Jon Eisenman, Jacob Farrell, Robert D'Emilio
7568, 2017-07-05, Jon Eisenman, Sebastian Davis, Chloë Zung
7569, 2017-07-06, Jon Eisenman, Liz Reardon, Rishi Sangani
7570, 2017-07-07, Jon Eisenman, Josh Hamilton, Susan Corica
7571, 2017-07-10, Susan Corica, Alyssa Mondelli, Rich Blashka
7572, 2017-07-11, Rich Blashka, Scott Simpson, Kelly Lasiter
7573, 2017-07-12, Kelly Lasiter, Gavin Borchert, Sara-Jane Whitaker
7574, 2017-07-13, Gavin Borchert, Terry Hanlon, Jill Staunton
7575, 2017-07-14, Gavin Borchert, Larissa Dizon, Vicky Smith
7576, 2017-07-17, Gavin Borchert, Deborah Elliott, Graydon Mears
7577, 2017-07-18, Deborah Elliott, Darcy Shapiro, Martin Chetlen
7578, 2017-07-19, Deborah Elliott, Nancy Bauer, Keith Fudge
7579, 2017-07-20, Deborah Elliott, Justin Vossler, Doug Groshart
7580, 2017-07-21, Justin Vossler, George Buri, Connie Rudd
7581, 2017-07-24, Justin Vossler, Emily Bridges, Shannon Hindahl
7582, 2017-07-25, Justin Vossler, Mackenzie Brooks, Catherine Meeker
7583, 2017-07-26, Justin Vossler, Seth Cope, Kellie Packwood
7584, 2017-07-27, Justin Vossler, Ryan Kious, Shadi Peterman
7585, 2017-07-28, Shadi Peterman, Mary Duffy, Dan Viafore
7586, 2017-09-11, Shadi Peterman, Laura Kelsay, Andrew Clyne
7587, 2017-09-12, Laura Kelsay, Linda Shaver-Gleason, Chris Fennell
7588, 2017-09-13, Laura Kelsay, Jen Sosnowski, Jay Olman
7589, 2017-09-14, Jen Sosnowski, Ellen Wernecke, Larry Coben
7590, 2017-09-15, Ellen Wernecke, Sarah Reisert, Julien Corven
7591, 2017-09-18, Ellen Wernecke, Andy Hyland, Angela Ward
7592, 2017-09-19, Angela Ward, Betsy Knudson, Farhad Mahmoudi
7593, 2017-09-20, Betsy Knudson, Justin Torello, Julie Roth
7594, 2017-09-21, Betsy Knudson, Thom Page, Diane Esemplare
7595, 2017-09-22, Betsy Knudson, Lauren Cusitello, Ivan Plis
7596, 2017-09-25, Ivan Plis, Anupama Srirangan, Dennis Fawcett
7597, 2017-09-26, Dennis Fawcett, Tina Doppler, Austin Rogers
7598, 2017-09-27, Austin Rogers, Pasha Paterson, Jennie Floyd
7599, 2017-09-28, Austin Rogers, Emily Dumas, Robert Barron
7600, 2017-09-29, Austin Rogers, Colin O’Bannon, Jim Bickford
7601, 2017-10-02, Austin Rogers, Veryl Gambino, Bonnie Leih
7602, 2017-10-03, Austin Rogers, Amy Servat, Ryan Hughey
7603, 2017-10-04, Austin Rogers, Marguerite Moran, Jay Hancock
7604, 2017-10-05, Austin Rogers, Todd McCafferty, Cathy Subick
7605, 2017-10-06, Austin Rogers, Rebekah Smith, Diana McInnis
7606, 2017-10-09, Austin Rogers, Rich Coble, Rain Dunaway
7607, 2017-10-10, Austin Rogers, Chris Cardinal, Sarah Favorite
7608, 2017-10-11, Austin Rogers, Lisa Rhae Burgess, Brian Kato
7609, 2017-10-12, Austin Rogers, Scarlett Sims, Sean Chong
7610, 2017-10-13, Scarlett Sims, Manny Abell, Michelle Kritselis
7611, 2017-10-16, Manny Abell, Emily Wilson, Jayanthi Martins
7612, 2017-10-17, Manny Abell, Carlos Nobleza Posas, Fran Fried
7613, 2017-10-18, Manny Abell, Joanna Kimmitt, Chelsea Feltman
7614, 2017-10-19, Joanna Kimmitt, Justin Broughman, Tom Blake
7615, 2017-10-20, Tom Blake, Tim Suba, Kathleen Kosman
7616, 2017-10-23, Kathleen Kosman, Marcus Leung, Nan Bauer
7617, 2017-10-24, Nan Bauer, Kristina Witzling, Rod Swain
7618, 2017-10-25, Nan Bauer, Edgar Castillo, Mary Grace Buckley
7619, 2017-10-26, Nan Bauer, Erica Irving, Phil Kohn
7620, 2017-10-27, Erica Irving, Ashley Phillips, Anand Kandaswamy
7621, 2017-10-30, Anand Kandaswamy, Charles Yu, Morgan Hanson
7622, 2017-10-31, Anand Kandaswamy, Patrick Theobald, Byron Merrill
7623, 2017-11-01, Anand Kandaswamy, Rahul Jain, Jenny Wrigley
7624, 2017-11-02, Jenny Wrigley, Monica Ashar, Kelvin Smith
7625, 2017-11-03, Monica Ashar, Kara Chandler, Nicole Jarvis
7636, 2017-11-20, Kara Chandler, Eric Maher, Alex Jumper
7637, 2017-11-21, Eric Maher, Kiana Nakamura, Wilbur Farley
7638, 2017-11-22, Kiana Nakamura, Jim Eckess, Kelsey Van Bokkem
7639, 2017-11-23, Kiana Nakamura, Liz Schultz, Jesse Parks
7640, 2017-11-24, Jesse Parks, Marcus Gresham, Jennifer Chang
7641, 2017-11-27, Marcus Gresham, Hilary Fried, Caity Willox
7642, 2017-11-28, Marcus Gresham, Amanda Barlau, Matt Preston
7643, 2017-11-29, Matt Preston, Missy Meyer, Shawn Adler
7644, 2017-11-30, Matt Preston, Lily Gebrenegus, Lisa Kristina
7645, 2017-12-01, Lisa Kristina, Tal Kedem, Melissa Fall
7646, 2017-12-04, Lisa Kristina, Alice Pelletier, Kyle Becker
7647, 2017-12-05, Kyle Becker, Matthias Clark, Kimberly Kist
7648, 2017-12-06, Kyle Becker, Lindsay Norsworthy, Eric Dravland
7649, 2017-12-07, Kyle Becker, Katia Noll, Joe Gaspard
7650, 2017-12-08, Kyle Becker, Laura Miller, Ben Raphel
7651, 2017-12-11, Ben Raphel, Charlie Santiuste, LaKedra Pam
7652, 2017-12-12, LaKedra Pam, Ian Shin, Sarah Woodring
7653, 2017-12-13, LaKedra Pam, Rachel Schemmel, Bryce Johnson
7654, 2017-12-14, Bryce Johnson, Craig Tollin, Brennan Summers
7655, 2017-12-15, Craig Tollin, Kiersten Brown, Denise Littlejohn
7656, 2017-12-18, Denise Littlejohn, Ben Cosman, Kate O'Connor
7657, 2017-12-19, Kate O'Connor, Lisa Beth Davis, Jordan Garroway
7658, 2017-12-20, Kate O'Connor, Remy Timbrook, Justin Bourassa
7659, 2017-12-21, Kate O'Connor, Eileen Palmer, Johnny Leon
7660, 2017-12-22, Johnny Leon, Donna Brown, Zach Heinen
7661, 2017-12-25, Donna Brown, Natalie Ballas, Charlie Harless
7662, 2017-12-26, Natalie Ballas, Cary Bonnell, Ami Li
7663, 2017-12-27, Ami Li, Kevin Foley, Sarah Walsh
7664, 2017-12-28, Kevin Foley, Vaishali Shetty, Travis Rojakovick
7665, 2017-12-29, Travis Rojakovick, Henry Ayoola, Gwynedd Stuart
7666, 2018-01-01, Henry Ayoola, Lisa McAndrews, Nick Spicher
7667, 2018-01-02, Nick Spicher, Saralee Etter, Olev Jaakson
7668, 2018-01-03, Saralee Etter, Steph Bundy, Michael Shockley
7669, 2018-01-04, Steph Bundy, Sean Sullivan, Meghan Whalen
7670, 2018-01-05, Sean Sullivan, Brandon Brooks, Claudia Hochstein
7671, 2018-01-08, Brandon Brooks, Jamie Rosler, Dave Daniel
7672, 2018-01-09, Brandon Brooks, Lindsay Resnick, Matt Brannagan
7673, 2018-01-10, Lindsay Resnick, Gilbert Collins, Flora Leen
7674, 2018-01-11, Gilbert Collins, Julie Zauzmer, Rebecca Zoshak
7675, 2018-01-12, Gilbert Collins, Alex Cook, Alisha Mathalikunnel
7676, 2018-01-15, Gilbert Collins, Steve Garbacz, Tyler Miksanek
7677, 2018-01-16, Gilbert Collins, Olivia Ochoa, David Rosen
7678, 2018-01-17, Gilbert Collins, Amanda Griggs, Lee Quinn
7679, 2018-01-18, Lee Quinn, Ryan Graham, Marilyn Rose
7680, 2018-01-19, Lee Quinn, Rachel Lindgren, Sarah Daly
7681, 2018-01-22, Rachel Lindgren, Gerard Simonette, Adrianne Woodward
7682, 2018-01-23, Rachel Lindgren, Alex Schindele, Katie Champagne
7683, 2018-01-24, Rachel Lindgren, Del Scott, Eric Raygor
7684, 2018-01-25, Rachel Lindgren, Rosie Jonker, Jeff Machusko
7685, 2018-01-26, Rachel Lindgren, Jennifer Tomassi, Melissa Stewart
7686, 2018-01-29, Jennifer Tomassi, Ryan Fenster, Maria Pecoraro
7687, 2018-01-30, Ryan Fenster, Emily Lewis, Brandey Chandler
7688, 2018-01-31, Ryan Fenster, Nate Pochomis, Elizabeth Connor
7689, 2018-02-01, Ryan Fenster, Sara Helmers, Justin Earnshaw
7690, 2018-02-02, Ryan Fenster, Caitlin Silberman, Jenny Rhodes
7691, 2018-02-05, Jenny Rhodes, Lorie Gasior, Sean Udicious
7692, 2018-02-06, Sean Udicious, Nabila Yusaf, Quin Lewellen
7693, 2018-02-07, Sean Udicious, Marcy Lehman, John Giambrone
7694, 2018-02-08, John Giambrone, Marty Cunningham, Alex Hotovy
7695, 2018-02-09, Marty Cunningham, Carlos Garcia, Alison Sahner
7696, 2018-02-12, Marty Cunningham, Dom Granello, Lindsey Piesz
7697, 2018-02-13, Marty Cunningham, Frank Lang, Emily Deckenback
7698, 2018-02-14, Frank Lang, Rob Worman, Erin Matherne
7699, 2018-02-15, Rob Worman, Matt Stikker, Shawn Ralston
7700, 2018-02-16, Rob Worman, Gianna Durso-Finley, Vinay Kadiyala
7701, 2018-02-19, Rob Worman, Kate Logan, Florence Garbini
7702, 2018-02-20, Rob Worman, John Carlson, Damien Marzocchi
7703, 2018-02-21, Rob Worman, Kristy Calman, Bryan Brzycki
7704, 2018-02-22, Rob Worman, Catherine Biba, Alan Harrison
7705, 2018-02-23, Alan Harrison, Kate Tucci, Mary Kalemkerian
7706, 2018-02-26, Alan Harrison, Maryann Penzvalto, Jonah Platt
7707, 2018-02-27, Maryann Penzvalto, Amy Finkelstein, Paul Mitchell Kelleher
7708, 2018-02-28, Maryann Penzvalto, Garan Geist, Laura McLean
7709, 2018-03-01, Laura McLean, Scott Krzywonos, Sarah Norris
7710, 2018-03-02, Laura McLean, Matt Lisiecki, Suzie Newman
7711, 2018-03-05, Matt Lisiecki, Shari Post, Jesse Darland
7712, 2018-03-06, Matt Lisiecki, Jack Rice, Rob Wivchar
7713, 2018-03-07, Jack Rice, Emily Perez, Lane Flynn
7714, 2018-03-08, Lane Flynn, Hannah Ewing, Liz McCarthy
7715, 2018-03-09, Lane Flynn, Megan Durazo, Mark Ashton
7716, 2018-03-12, Mark Ashton, Ashley O'Mara, Zach Dark
7717, 2018-03-13, Zach Dark, Paris Themmen, McKayle Bruce
7718, 2018-03-14, Zach Dark, Allison Berke, Peter Karamitsos
7719, 2018-03-15, Peter Karamitsos, Tracey Hollabaugh, Amy Yacorzynski
7720, 2018-03-16, Peter Karamitsos, Dan Lee, Rahul Gupta
7721, 2018-03-19, Rahul Gupta, Lisa Mueller, Regis Michelena
7722, 2018-03-20, Lisa Mueller, AJ Freeman, John Bizal
7723, 2018-03-21, Lisa Mueller, Rebecca Zoshak, Chris Frantz
7724, 2018-03-22, Rebecca Zoshak, Natasha Go, Lynn Klyde-Allaman
7725, 2018-03-23, Lynn Klyde-Allaman, Tristan Mohabir, Daniel Ludlam
7726, 2018-03-26, Tristan Mohabir, Vicki Cole, Johnny Trutor
7727, 2018-03-27, Johnny Trutor, Katy Rosati, Robert Dimitri
7728, 2018-03-28, Robert Dimitri, Joey DiNardi, Emily Milan
7729, 2018-03-29, Emily Milan, Shannan Younger, Alex Lopinto
7730, 2018-03-30, Emily Milan, Jen Simons, Tyler Morrison
7731, 2018-04-02, Emily Milan, Elizabeth Johnson, Daniel Carden
7732, 2018-04-03, Daniel Carden, Ashley Chapman, Jack Dickey
7733, 2018-04-04, Jack Dickey, Lydia Disabatino, Michael Boss
7734, 2018-04-05, Jack Dickey, Kristin Robbins, Arielle Lipshaw
7735, 2018-04-06, Kristin Robbins, Andrews Landsman, Dominick Fiorentino
7746, 2018-04-23, Kristin Robbins, Kate Jovin, Rex Moroux
7747, 2018-04-24, Kate Jovin, Randy Mathews, Alyssa Abel
7748, 2018-04-25, Randy Mathews, Jen Regan, Krishna Veeraraghavan
7749, 2018-04-26, Jen Regan, Robert Marx, Carolyn Walsh
7750, 2018-04-27, Carolyn Walsh, Tom McGinnis, Alexandra Henkoff
7751, 2018-04-30, Alexandra Henkoff, Osman Syed, Leslye Laderman
7752, 2018-05-01, Osman Syed, Jan Brown, Geoff Brousseau
7753, 2018-05-02, Geoff Brousseau, Josh Hill, Laura Buermann
7754, 2018-05-03, Josh Hill, Melissa Anthony, Kurt Buhring
7755, 2018-05-04, Josh Hill, Jessica Fox, Julie Sesnovich
7766, 2018-05-21, Josh Hill, Kate Fink, Gary Waters
7767, 2018-05-22, Josh Hill, Hermine Vermeij, Andrew Lai
7768, 2018-05-23, Josh Hill, Luke Devlin, Tara Yack
7769, 2018-05-24, Josh Hill, Kristen Krikorian, Tom Campo
7770, 2018-05-25, Josh Hill, Virginia Cummings, Ross Belsome
7771, 2018-05-28, Virginia Cummings, Andrea Schuelke, Dev Thakur
7772, 2018-05-29, Virginia Cummings, Jeffrey Schwarz, Tim Young
7773, 2018-05-30, Jeffrey Schwarz, Amanda McClendon, Amy Cuzzolino
7774, 2018-05-31, Jeffrey Schwarz, Maryanne Theyerl, Skyler Kelemen
7775, 2018-06-01, Jeffrey Schwarz, Ian Booth, Dan Hess
7776, 2018-06-04, Ian Booth, Leslie Manion, Tommy Fagin
7777, 2018-06-05, Leslie Manion, Joe Castro, Megan Beesley
7778, 2018-06-06, Joe Castro, Michelle Rosen, Sharron Jenkins
7779, 2018-06-07, Michelle Rosen, Mirza Gluhic, Andy Mills
7780, 2018-06-08, Mirza Gluhic, David Kleinman, John Fassola
7781, 2018-06-11, David Kleinman, Tracey Lazareth, Catherine Ono
7782, 2018-06-12, Catherine Ono, Rebecca Heide, Jason Downer
7783, 2018-06-13, Catherine Ono, Diana Hsu, Nick Anspach
7784, 2018-06-14, Diana Hsu, Adam Manning, Katherine Pisarro-Grant
7785, 2018-06-15, Diana Hsu, Deirdre Thomas, Jon Brown
7786, 2018-06-18, Deirdre Thomas, Sara Nies, Erik Johnson
7787, 2018-06-19, Deirdre Thomas, Jessica Rea, Ali Hasan
7788, 2018-06-20, Ali Hasan, Lindsay Garces, Tyler Dilts
7789, 2018-06-21, Ali Hasan, Justin Cosgrove, Deb Seltzer
7790, 2018-06-22, Ali Hasan, Jordan Nussbaum, Amanda Graver
7791, 2018-06-25, Jordan Nussbaum, Ben Henry-Moreland, Kelly Griffin
7792, 2018-06-26, Kelly Griffin, Jeff Witte, Andrew King
7793, 2018-06-27, Andrew King, Amy Goodchild, Scott McFadden
7794, 2018-06-28, Scott McFadden, Frank Young, Kat Long
7795, 2018-06-29, Scott McFadden, Ruth Payne, Nick Hurwitz
7796, 2018-07-02, Scott McFadden, Adam Scholze, Suzanne Koppelman
7797, 2018-07-03, Suzanne Koppelman, Jim McGinnis, Dave Baltmanis
7798, 2018-07-04, Suzanne Koppelman, Liz Howard, Kate Brandt
7799, 2018-07-05, Suzanne Koppelman, Marilyn Maher, Steve Spriensma
7800, 2018-07-06, Marilyn Maher, Beth Feest, Lauren Kiehna
7801, 2018-07-09, Lauren Kiehna, Wes Hazard, Ray Coshow
7802, 2018-07-10, Wes Hazard, Becky Wilson, Doug Dworkin
7803, 2018-07-11, Wes Hazard, George Holcomb, Stel Plakas
7804, 2018-07-12, Wes Hazard, Michelle Cabral, Johanna Schaufeld
7805, 2018-07-13, Michelle Cabral, Vincent Valenzuela, Bryan Rucker
7806, 2018-07-16, Michelle Cabral, Niraj Dhami, Rebecca Smith
7807, 2018-07-17, Michelle Cabral, Bunny Miller, Ryan Fenster
7808, 2018-07-18, Ryan Fenster, Kyle Adams, Caitlion O'Neill
7809, 2018-07-19, Ryan Fenster, Justin Moody, Michelle Mueckler
7810, 2018-07-20, Ryan Fenster, Emily Moore, Dave Mattingly
7811, 2018-07-23, Dave Mattingly, Hollie Schmidt, Neel Kotra
7812, 2018-07-24, Dave Mattingly, Beth Schoenbach, Tara O'Byrne
7813, 2018-07-25, Dave Mattingly, Burt Westermeier, Ron Freshour
7814, 2018-07-26, Burt Westermeier, Ian Flynn, Rick Terpstra
7815, 2018-07-27, Rick Terpstra, Karla Nickels, Jerry Tsai
7816, 2018-09-10, Rick Terpstra, Isaac Loeb, Caitlin Sok
7817, 2018-09-11, Rick Terpstra, Lori Goodman, Becky Warren
7818, 2018-09-12, Lori Goodman, Kyle Jones, Monica Couch
7819, 2018-09-13, Kyle Jones, Shawn Moore, Lauren Stripling
7820, 2018-09-14, Kyle Jones, Riley Westmoreland, Andrew Lundy
7821, 2018-09-17, Kyle Jones, Christine O'Donnell, Reese Wallace
7822, 2018-09-18, Kyle Jones, Emily Brown, Raymond Quianzon
7823, 2018-09-19, Kyle Jones, Jonathan Lau, Jordan Moore
7824, 2018-09-20, Kyle Jones, Bucky McMahon, Amanda Levreault
7825, 2018-09-21, Kyle Jones, Rob Salerno, Dino Alexander
7826, 2018-09-24, Rob Salerno, William Benson, Nancy Schoppa
7827, 2018-09-25, Nancy Schoppa, Vincent Valenzuela, Courtney Llewellyn
7828, 2018-09-26, Nancy Schoppa, Evelyn Rubin, Jordan Boyd-Graber Ying
7829, 2018-09-27, Evelyn Rubin, Michael Pascuzzi, Katie Lombardo
7830, 2018-09-28, Evelyn Rubin, Andrew Knudsen, Barbara Gooby
7831, 2018-10-01, Andrew Knudsen, Carl Conway, Doug Dodson
7832, 2018-10-02, Doug Dodson, Cody Landis, Kirsten Morry
7833, 2018-10-03, Doug Dodson, Maggie Beazer, Susan Donnelly-Kaye
7834, 2018-10-04, Doug Dodson, Kian Barry, Sara Butner
7835, 2018-10-05, Sara Butner, Maureen Block, Adam Francois Watkins
7836, 2018-10-08, Adam Francois Watkins, Alex Schmidt, Lee Glazer
7837, 2018-10-09, Alex Schmidt, Jen Aronoff, Greg Antoine
7838, 2018-10-10, Alex Schmidt, Mary Adolph, Chris Wong
7839, 2018-10-11, Alex Schmidt, Patrick Wyman, Kristina Johnson
7840, 2018-10-12, Alex Schmidt, Ryan Vesledahl, Alan Dunn
7841, 2018-10-15, Alan Dunn, Sarah Sinclair, Tosh Sagar
7842, 2018-10-16, Alan Dunn, Hila Saxer, Prairie Rose Clayton
7843, 2018-10-17, Alan Dunn, Allison Stevens, Julie Holzmann
7844, 2018-10-18, Alan Dunn, Jessica Cantrell, Mark Johnson
7845, 2018-10-19, Alan Dunn, Erik Agard, Herschel Purvis
7846, 2018-10-22, Erik Agard, Mike Jenkins, Joanna Rom
7847, 2018-10-23, Erik Agard, Traci Clark, Patrick Healy
7848, 2018-10-24, Erik Agard, Hannah McIntyre, Rock Wayda
7849, 2018-10-25, Hannah McIntyre, Jill Hurtt, Dhruv Srinivasachar
7850, 2018-10-26, Dhruv Srinivasachar, Tori Campbell, Todd LaPlace
7851, 2018-10-29, Tori Campbell, Soyia Ellison, Neill Mohammad
7852, 2018-10-30, Tori Campbell, Allen Adams, Emily Frey
7853, 2018-10-31, Emily Frey, Adam Soffrin, Swapna Sathe
7854, 2018-11-01, Emily Frey, Jeff Catanese, Kathleen Nance
7855, 2018-11-02, Emily Frey, Laura Hite, Jonathan Greenan
7856, 2018-11-05, Jonathan Greenan, Mary Ann Borer, Gerald Dudley
7857, 2018-11-06, Mary Ann Borer, Lonnie Weis, Chloe Sjuberg
7868, 2018-11-21, Mary Ann Borer, Casey Amspacher, Abby Roughton
7869, 2018-11-22, Mary Ann Borer, Terrie Vasilopoulos, David Trachtenberg
7870, 2018-11-23, Mary Ann Borer, Jennifer Hoosier, J Cheema
7871, 2018-11-26, J Cheema, Dylan Hamilton, Bridget Sullivan
7872, 2018-11-27, Dylan Hamilton, Carol Radlo, Myra Guideng
7873, 2018-11-28, Dylan Hamilton, Andrew Miller, Adriana Ciccone
7874, 2018-11-29, Adriana Ciccone, Chris Williams, Phil Tompkins
7875, 2018-11-30, Adriana Ciccone, Elizabeth Goss, Ben Goldstein
7876, 2018-12-03, Elizabeth Goss, Dave Leffler, Bernadette Nguyen
7877, 2018-12-04, Dave Leffler, Alexander Schwab, Tiffany Brooks
7878, 2018-12-05, Dave Leffler, Amy David, Brian Panulla
7879, 2018-12-06, Dave Leffler, Samir Patel, Pat Berwick
7880, 2018-12-07, Dave Leffler, Staci Huffman, Nick Wawrykow
7881, 2018-12-10, Staci Huffman, Swetha Dravida, Francesco Caporusso
7882, 2018-12-11, Francesco Caporusso, Nicole Cocklin, John Henning Schumann
